date_str,open,high,low,close,volume,adjusted,date_std_format
Date (MM/DD/YYYY): 12/01/1997,17.7421875,18.0,17.703125,17.9765625,49006400,11.0016469955444,1997-12-01
Date (MM/DD/YYYY): 12/02/1997,17.9453125,18.109375,17.75,17.78125,50167200,10.8821144104004,1997-12-02
Date (MM/DD/YYYY): 12/03/1997,17.7109375,18.1328125,17.625,18.0859375,57712000,11.0685796737671,1997-12-03
Date (MM/DD/YYYY): 12/04/1997,18.09375,18.234375,17.78125,17.8203125,62630400,10.9060201644897,1997-12-04
Date (MM/DD/YYYY): 12/05/1997,17.765625,18.09375,17.765625,17.890625,48136000,10.9490509033203,1997-12-05
Date (MM/DD/YYYY): 12/08/1997,17.9375,18.328125,17.890625,18.265625,49952800,11.1785526275635,1997-12-08
Date (MM/DD/YYYY): 12/09/1997,18.125,18.171875,17.9375,18.0390625,51782400,11.0398950576782,1997-12-09
Date (MM/DD/YYYY): 12/10/1997,17.78125,17.90625,17.625,17.78125,66434400,10.8821144104004,1997-12-10
Date (MM/DD/YYYY): 12/11/1997,17.546875,17.625,17.359375,17.3828125,70189600,10.6382675170898,1997-12-11
Date (MM/DD/YYYY): 12/12/1997,17.21875,17.3125,17.0,17.09375,54308000,10.4613637924194,1997-12-12
Date (MM/DD/YYYY): 12/15/1997,17.0546875,17.125,16.625,17.015625,84305600,10.4135503768921,1997-12-15
Date (MM/DD/YYYY): 12/16/1997,16.984375,17.546875,16.875,17.3828125,65401600,10.6382675170898,1997-12-16
Date (MM/DD/YYYY): 12/17/1997,17.484375,17.546875,16.9375,16.953125,51472000,10.3753004074097,1997-12-17
Date (MM/DD/YYYY): 12/18/1997,16.8125,16.84375,16.296875,16.359375,98774400,10.0119228363037,1997-12-18
Date (MM/DD/YYYY): 12/19/1997,16.09375,16.2734375,15.78125,16.0859375,138065600,9.84458637237549,1997-12-19
Date (MM/DD/YYYY): 12/22/1997,16.140625,16.25,15.734375,15.875,59063200,9.71549224853516,1997-12-22
Date (MM/DD/YYYY): 12/23/1997,15.8828134536743,16.03125,15.375,15.4140634536743,67195200,9.43339824676514,1997-12-23
Date (MM/DD/YYYY): 12/24/1997,15.46875,15.484375,14.75,14.8671884536743,88411200,9.09870529174805,1997-12-24
Date (MM/DD/YYYY): 12/26/1997,14.859375,15.09375,14.84375,15.09375,32388800,9.23736095428467,1997-12-26
Date (MM/DD/YYYY): 12/29/1997,15.296875,15.84375,15.265625,15.7890634536743,67815200,9.6628942489624,1997-12-29
Date (MM/DD/YYYY): 12/30/1997,15.8046884536743,16.375,15.78125,16.28125,77864800,9.96411514282227,1997-12-30
Date (MM/DD/YYYY): 12/31/1997,16.375,16.4375,16.125,16.15625,46147200,9.8876142501831,1997-12-31
Date (MM/DD/YYYY): 01/02/1998,16.203125,16.4375,16.1875,16.390625,39748000,10.0310506820679,1998-01-02
Date (MM/DD/YYYY): 01/05/1998,16.40625,16.703125,15.984375,16.296875,80377600,9.97367763519287,1998-01-05
Date (MM/DD/YYYY): 01/06/1998,16.21875,16.625,16.15625,16.390625,67834400,10.0310506820679,1998-01-06
Date (MM/DD/YYYY): 01/07/1998,16.234375,16.3984375,15.9375,16.1953125,61492800,9.91152095794678,1998-01-07
Date (MM/DD/YYYY): 01/08/1998,16.078125,16.515625,15.9375,16.3125,77619200,9.98323822021484,1998-01-08
Date (MM/DD/YYYY): 01/09/1998,16.2578125,16.4375,15.734375,15.875,87534400,9.71549224853516,1998-01-09
Date (MM/DD/YYYY): 01/12/1998,15.578125,16.25,15.546875,16.1875,78393600,9.90674018859863,1998-01-12
Date (MM/DD/YYYY): 01/13/1998,16.1875,16.53125,16.015625,16.515625,66945600,10.1075525283813,1998-01-13
Date (MM/DD/YYYY): 01/14/1998,16.515625,16.5625,16.15625,16.390625,54774400,10.0310506820679,1998-01-14
Date (MM/DD/YYYY): 01/15/1998,16.296875,16.625,16.234375,16.5390625,50622400,10.1218938827515,1998-01-15
Date (MM/DD/YYYY): 01/16/1998,16.546875,16.921875,16.5390625,16.90625,72943200,10.3466167449951,1998-01-16
Date (MM/DD/YYYY): 01/20/1998,16.765625,17.25,16.75,17.2265625,64956000,10.5426464080811,1998-01-20
Date (MM/DD/YYYY): 01/21/1998,17.15625,17.3046875,16.953125,17.125,85567200,10.4804887771606,1998-01-21
Date (MM/DD/YYYY): 01/22/1998,16.9453125,17.484375,16.9140625,17.328125,159139200,10.6048030853271,1998-01-22
Date (MM/DD/YYYY): 01/23/1998,17.34375,17.4296875,17.087890625,17.28125,63312000,10.5761127471924,1998-01-23
Date (MM/DD/YYYY): 01/26/1998,17.484375,17.734375,17.306640625,17.71875,74277600,10.8438625335693,1998-01-26
Date (MM/DD/YYYY): 01/27/1998,17.796875,18.234375,17.6953125,18.1484375,97540800,11.1068325042725,1998-01-27
Date (MM/DD/YYYY): 01/28/1998,18.28125,18.6875,18.1875,18.625,79387200,11.3984889984131,1998-01-28
Date (MM/DD/YYYY): 01/29/1998,18.6171875,18.765625,18.4375,18.53125,73571200,11.3411140441895,1998-01-29
Date (MM/DD/YYYY): 01/30/1998,18.578125,18.75,18.453125,18.6484375,50071200,11.4128313064575,1998-01-30
Date (MM/DD/YYYY): 02/02/1998,18.96875,19.390625,18.8125,19.359375,98397600,11.8479204177856,1998-02-02
Date (MM/DD/YYYY): 02/03/1998,19.390625,19.515625,19.2265625,19.484375,61374400,11.9244213104248,1998-02-03
Date (MM/DD/YYYY): 02/04/1998,19.484375,19.75,19.3828125,19.6015625,61940800,11.9961395263672,1998-02-04
Date (MM/DD/YYYY): 02/05/1998,19.765625,19.84375,19.34375,19.4296875,67014400,11.8909578323364,1998-02-05
Date (MM/DD/YYYY): 02/06/1998,19.421875,19.78125,19.390625,19.765625,50070400,12.0965480804443,1998-02-06
Date (MM/DD/YYYY): 02/09/1998,19.84375,19.859375,19.453125,19.6484375,54681600,12.0248279571533,1998-02-09
Date (MM/DD/YYYY): 02/10/1998,19.65625,19.9375,19.59375,19.90625,48099200,12.1826095581055,1998-02-10
Date (MM/DD/YYYY): 02/11/1998,19.921875,20.0078125,19.6328125,19.8671875,76460000,12.1587085723877,1998-02-11
Date (MM/DD/YYYY): 02/12/1998,19.7578125,19.8671875,19.5546875,19.84375,76658400,12.144362449646,1998-02-12
Date (MM/DD/YYYY): 02/13/1998,19.828125,19.84375,19.671875,19.6875,42203200,12.0487403869629,1998-02-13
Date (MM/DD/YYYY): 02/17/1998,19.8125,19.8125,19.234375,19.296875,85673600,11.8096714019775,1998-02-17
Date (MM/DD/YYYY): 02/18/1998,19.328125,19.5,19.21875,19.328125,76608800,11.8287963867188,1998-02-18
Date (MM/DD/YYYY): 02/19/1998,19.4375,19.5078125,19.28125,19.359375,73773600,11.8479204177856,1998-02-19
Date (MM/DD/YYYY): 02/20/1998,19.4375,19.46875,19.109375,19.390625,86092000,11.8670463562012,1998-02-20
Date (MM/DD/YYYY): 02/23/1998,20.234375,20.421875,19.84375,20.40625,120803600,12.4886112213135,1998-02-23
Date (MM/DD/YYYY): 02/24/1998,20.84375,21.234375,20.46875,20.53125,118302000,12.5651121139526,1998-02-24
Date (MM/DD/YYYY): 02/25/1998,20.859375,21.25,20.765625,21.234375,94944400,12.9954223632812,1998-02-25
Date (MM/DD/YYYY): 02/26/1998,21.375,21.421875,21.109375,21.375,61388000,13.0814809799194,1998-02-26
Date (MM/DD/YYYY): 02/27/1998,21.390625,21.5,21.140625,21.1875,47532400,12.9667310714722,1998-02-27
Date (MM/DD/YYYY): 03/02/1998,21.46875,21.46875,20.765625,20.828125,50093600,12.7468004226685,1998-03-02
Date (MM/DD/YYYY): 03/03/1998,20.65625,21.140625,20.640625,21.125,50753600,12.9284830093384,1998-03-03
Date (MM/DD/YYYY): 03/04/1998,20.609375,20.953125,20.390625,20.578125,71513600,12.5938014984131,1998-03-04
Date (MM/DD/YYYY): 03/05/1998,19.8125,20.359375,19.8125,20.015625,92255600,12.2495450973511,1998-03-05
Date (MM/DD/YYYY): 03/06/1998,20.078125,20.6875,20.0625,20.6875,51404800,12.660737991333,1998-03-06
Date (MM/DD/YYYY): 03/09/1998,20.625,20.625,19.875,19.8984375,52256000,12.1778316497803,1998-03-09
Date (MM/DD/YYYY): 03/10/1998,20.296875,20.375,19.984375,20.375,47406400,12.4694881439209,1998-03-10
Date (MM/DD/YYYY): 03/11/1998,20.5,20.5,19.9375,20.171875,39838800,12.3451690673828,1998-03-11
Date (MM/DD/YYYY): 03/12/1998,20.625,20.65625,20.203125,20.46875,47962000,12.5268630981445,1998-03-12
Date (MM/DD/YYYY): 03/13/1998,20.609375,20.75,20.390625,20.59375,32542400,12.6033620834351,1998-03-13
Date (MM/DD/YYYY): 03/16/1998,20.609375,20.6875,20.34375,20.5,27979600,12.5459833145142,1998-03-16
Date (MM/DD/YYYY): 03/17/1998,20.421875,20.421875,19.921875,20.09375,53842400,12.2973651885986,1998-03-17
Date (MM/DD/YYYY): 03/18/1998,20.015625,20.453125,19.96875,20.4375,33887600,12.5077362060547,1998-03-18
Date (MM/DD/YYYY): 03/19/1998,20.375,20.578125,20.3125,20.5,30299200,12.5459833145142,1998-03-19
Date (MM/DD/YYYY): 03/20/1998,20.53125,20.75,20.125,20.453125,56310000,12.5173053741455,1998-03-20
Date (MM/DD/YYYY): 03/23/1998,20.296875,21.15625,20.265625,20.96875,55050000,12.832859992981,1998-03-23
Date (MM/DD/YYYY): 03/24/1998,21.046875,21.265625,20.859375,21.234375,32281600,12.9954223632812,1998-03-24
Date (MM/DD/YYYY): 03/25/1998,22.625,22.734375,21.8125,22.203125,124244800,13.5882968902588,1998-03-25
Date (MM/DD/YYYY): 03/26/1998,22.125,22.390625,21.875,22.0625,45441200,13.5022277832031,1998-03-26
Date (MM/DD/YYYY): 03/27/1998,22.34375,22.34375,21.890625,21.953125,38924000,13.435299873352,1998-03-27
Date (MM/DD/YYYY): 03/30/1998,22.015625,22.15625,21.78125,21.984375,27463200,13.454418182373,1998-03-30
Date (MM/DD/YYYY): 03/31/1998,22.15625,22.4375,22.125,22.375,38177200,13.6934843063354,1998-03-31
Date (MM/DD/YYYY): 04/01/1998,22.453125,22.65625,22.125,22.59375,36835600,13.8273611068726,1998-04-01
Date (MM/DD/YYYY): 04/02/1998,22.671875,22.984375,22.46875,22.828125,41414800,13.9708003997803,1998-04-02
Date (MM/DD/YYYY): 04/03/1998,23.0,23.265625,22.875,23.25,40987600,14.2289838790894,1998-04-03
Date (MM/DD/YYYY): 04/06/1998,23.15625,23.15625,22.265625,22.484375,74232000,13.7604207992554,1998-04-06
Date (MM/DD/YYYY): 04/07/1998,22.328125,22.65625,21.6875,21.8125,62630800,13.3492307662964,1998-04-07
Date (MM/DD/YYYY): 04/08/1998,21.6875,22.25,21.65625,22.234375,36793200,13.6074237823486,1998-04-08
Date (MM/DD/YYYY): 04/09/1998,21.984375,22.40625,21.875,22.25,33619200,13.616982460022,1998-04-09
Date (MM/DD/YYYY): 04/13/1998,22.203125,22.25,21.6875,22.15625,33156400,13.5596036911011,1998-04-13
Date (MM/DD/YYYY): 04/14/1998,22.171875,22.390625,21.875,22.109375,28476800,13.5309228897095,1998-04-14
Date (MM/DD/YYYY): 04/15/1998,22.3125,22.84375,22.21875,22.84375,40498400,13.9803609848022,1998-04-15
Date (MM/DD/YYYY): 04/16/1998,22.59375,23.015625,22.546875,22.921875,39695600,14.0281715393066,1998-04-16
Date (MM/DD/YYYY): 04/17/1998,22.875,23.0625,22.578125,23.03125,37402800,14.0951080322266,1998-04-17
Date (MM/DD/YYYY): 04/20/1998,23.09375,23.75,23.046875,23.65625,45535200,14.4776105880737,1998-04-20
Date (MM/DD/YYYY): 04/21/1998,23.671875,23.75,23.28125,23.71875,51938400,14.5158605575562,1998-04-21
Date (MM/DD/YYYY): 04/22/1998,24.0,24.78125,23.90625,24.71875,80154000,15.127854347229,1998-04-22
Date (MM/DD/YYYY): 04/23/1998,24.3125,24.34375,23.53515625,23.625,64215200,14.4584865570068,1998-04-23
Date (MM/DD/YYYY): 04/24/1998,23.375,23.6875,22.96875,23.03125,51436000,14.0951080322266,1998-04-24
Date (MM/DD/YYYY): 04/27/1998,22.375,22.6328125,22.125,22.578125,58752000,13.8177928924561,1998-04-27
Date (MM/DD/YYYY): 04/28/1998,23.03125,23.0625,22.25390625,22.46875,56668000,13.750864982605,1998-04-28
Date (MM/DD/YYYY): 04/29/1998,22.515625,22.875,22.40625,22.625,50061600,13.8464851379395,1998-04-29
Date (MM/DD/YYYY): 04/30/1998,22.875,22.90625,22.421875,22.53125,54473600,13.7891063690186,1998-04-30
Date (MM/DD/YYYY): 05/01/1998,22.546875,22.625,22.03125,22.40625,35996000,13.7126092910767,1998-05-01
Date (MM/DD/YYYY): 05/04/1998,22.296875,22.46875,21.984375,22.015625,37899600,13.4735403060913,1998-05-04
Date (MM/DD/YYYY): 05/05/1998,21.90625,22.390625,21.75,21.9375,50828000,13.4257373809814,1998-05-05
Date (MM/DD/YYYY): 05/06/1998,21.875,21.875,21.5,21.59375,48110800,13.2153568267822,1998-05-06
Date (MM/DD/YYYY): 05/07/1998,21.546875,21.5625,20.796875,20.84375,78022000,12.7563562393188,1998-05-07
Date (MM/DD/YYYY): 05/08/1998,20.46875,21.53125,20.46875,21.4375,96274800,13.1197319030762,1998-05-08
Date (MM/DD/YYYY): 05/11/1998,21.53125,21.546875,21.015625,21.0625,51474400,12.8902339935303,1998-05-11
Date (MM/DD/YYYY): 05/12/1998,20.8125,21.4375,20.8125,21.421875,64147200,13.1101732254028,1998-05-12
Date (MM/DD/YYYY): 05/13/1998,22.171875,22.1875,21.625,21.734375,80680400,13.3014221191406,1998-05-13
Date (MM/DD/YYYY): 05/14/1998,21.46875,22.75,21.453125,22.234375,94774400,13.6074237823486,1998-05-14
Date (MM/DD/YYYY): 05/15/1998,22.53125,22.546875,22.1875,22.359375,48150800,13.6839246749878,1998-05-15
Date (MM/DD/YYYY): 05/18/1998,21.125,21.625,21.125,21.515625,80395600,13.1675453186035,1998-05-18
Date (MM/DD/YYYY): 05/19/1998,21.453125,21.734375,21.390625,21.625,52234400,13.2344856262207,1998-05-19
Date (MM/DD/YYYY): 05/20/1998,21.53125,21.71875,21.34375,21.4375,35698800,13.1197319030762,1998-05-20
Date (MM/DD/YYYY): 05/21/1998,21.453125,21.84375,21.375,21.59375,36680000,13.2153568267822,1998-05-21
Date (MM/DD/YYYY): 05/22/1998,21.65625,21.6875,21.359375,21.390625,36129200,13.0910453796387,1998-05-22
Date (MM/DD/YYYY): 05/26/1998,21.328125,21.546875,20.875,20.90625,44473600,12.7946119308472,1998-05-26
Date (MM/DD/YYYY): 05/27/1998,20.71875,21.53125,20.71875,21.5,58574400,13.1579885482788,1998-05-27
Date (MM/DD/YYYY): 05/28/1998,21.4375,21.59375,21.265625,21.578125,30746800,13.2057991027832,1998-05-28
Date (MM/DD/YYYY): 05/29/1998,21.59375,21.625,21.1875,21.203125,34091200,12.9762954711914,1998-05-29
Date (MM/DD/YYYY): 06/01/1998,20.96875,21.15234375,20.78125,20.9375,42436800,12.8137397766113,1998-06-01
Date (MM/DD/YYYY): 06/02/1998,21.015625,21.484375,20.96875,21.375,38570800,13.0814809799194,1998-06-02
Date (MM/DD/YYYY): 06/03/1998,21.46875,21.609375,21.03125,21.078125,36010800,12.8997974395752,1998-06-03
Date (MM/DD/YYYY): 06/04/1998,21.171875,21.53125,20.90625,21.515625,33717600,13.1675453186035,1998-06-04
Date (MM/DD/YYYY): 06/05/1998,21.46875,21.625,21.1875,21.5625,34431600,13.1962327957153,1998-06-05
Date (MM/DD/YYYY): 06/08/1998,21.40625,21.578125,21.25,21.421875,18886400,13.1101732254028,1998-06-08
Date (MM/DD/YYYY): 06/09/1998,21.328125,21.890625,21.3125,21.765625,35690400,13.3205499649048,1998-06-09
Date (MM/DD/YYYY): 06/10/1998,21.65625,22.09375,21.46875,21.5,33290400,13.1579885482788,1998-06-10
Date (MM/DD/YYYY): 06/11/1998,21.609375,21.78125,21.28125,21.328125,41271200,13.0527973175049,1998-06-11
Date (MM/DD/YYYY): 06/12/1998,21.21875,21.53125,21.0,21.4375,41323600,13.1197319030762,1998-06-12
Date (MM/DD/YYYY): 06/15/1998,21.171875,21.828125,21.140625,21.484375,42846000,13.1484260559082,1998-06-15
Date (MM/DD/YYYY): 06/16/1998,21.578125,22.484375,21.375,22.46875,61138400,13.750864982605,1998-06-16
Date (MM/DD/YYYY): 06/17/1998,22.484375,23.09375,22.4375,22.765625,76147600,13.9325466156006,1998-06-17
Date (MM/DD/YYYY): 06/18/1998,22.703125,22.9375,22.59375,22.796875,39228400,13.9516658782959,1998-06-18
Date (MM/DD/YYYY): 06/19/1998,23.21875,23.6875,23.125,23.671875,91226800,14.48717212677,1998-06-19
Date (MM/DD/YYYY): 06/22/1998,23.6875,23.984375,23.421875,23.953125,48969600,14.6592922210693,1998-06-22
Date (MM/DD/YYYY): 06/23/1998,23.953125,25.21875,23.8125,25.1875,124675200,15.4147262573242,1998-06-23
Date (MM/DD/YYYY): 06/24/1998,25.421875,26.28125,24.984375,26.234375,105724800,16.0554180145264,1998-06-24
Date (MM/DD/YYYY): 06/25/1998,26.46875,26.71875,25.34375,25.390625,88969600,15.5390501022339,1998-06-25
Date (MM/DD/YYYY): 06/26/1998,25.5625,26.15625,25.5,26.109375,55680400,15.9789161682129,1998-06-26
Date (MM/DD/YYYY): 06/29/1998,26.375,26.921875,26.3125,26.859375,65906000,16.4379119873047,1998-06-29
Date (MM/DD/YYYY): 06/30/1998,26.3125,27.140625,26.15625,27.09375,77010000,16.581356048584,1998-06-30
Date (MM/DD/YYYY): 07/01/1998,27.28125,27.53125,26.796875,27.34375,53470400,16.7343616485596,1998-07-01
Date (MM/DD/YYYY): 07/02/1998,27.203125,27.28125,26.78125,26.8125,27321200,16.4092330932617,1998-07-02
Date (MM/DD/YYYY): 07/06/1998,26.71875,27.015625,26.34375,26.953125,35307600,16.495288848877,1998-07-06
Date (MM/DD/YYYY): 07/07/1998,26.953125,27.140625,26.625,26.984375,32422800,16.5144214630127,1998-07-07
Date (MM/DD/YYYY): 07/08/1998,27.03125,27.53125,26.6875,27.46875,41553600,16.8108539581299,1998-07-08
Date (MM/DD/YYYY): 07/09/1998,27.5,28.0,27.4375,27.75,43690000,16.9829845428467,1998-07-09
Date (MM/DD/YYYY): 07/10/1998,27.78125,28.3125,27.46875,28.296875,45396800,17.3176689147949,1998-07-10
Date (MM/DD/YYYY): 07/13/1998,28.53125,29.5625,28.40625,29.390625,69223200,17.9870338439941,1998-07-13
Date (MM/DD/YYYY): 07/14/1998,29.5625,29.6875,28.875,29.125,56972400,17.8244762420654,1998-07-14
Date (MM/DD/YYYY): 07/15/1998,29.0,29.5,28.90625,29.34375,48690000,17.9583606719971,1998-07-15
Date (MM/DD/YYYY): 07/16/1998,29.515625,29.71875,29.15625,29.34375,65125200,17.9583606719971,1998-07-16
Date (MM/DD/YYYY): 07/17/1998,29.375,29.90625,28.984375,29.484375,83108400,18.0444183349609,1998-07-17
Date (MM/DD/YYYY): 07/20/1998,29.546875,29.875,29.203125,29.25,45794800,17.9009838104248,1998-07-20
Date (MM/DD/YYYY): 07/21/1998,29.21875,29.75,28.125,28.203125,74605200,17.2602882385254,1998-07-21
Date (MM/DD/YYYY): 07/22/1998,28.0,29.3125,27.96875,29.1875,71654400,17.8627243041992,1998-07-22
Date (MM/DD/YYYY): 07/23/1998,29.078125,29.375,28.25,28.25,51029600,17.2889823913574,1998-07-23
Date (MM/DD/YYYY): 07/24/1998,28.4375,28.90625,28.125,28.453125,60366400,17.4132919311523,1998-07-24
Date (MM/DD/YYYY): 07/27/1998,28.28125,29.1875,27.671875,29.1875,58998000,17.8627243041992,1998-07-27
Date (MM/DD/YYYY): 07/28/1998,29.0,29.21875,28.0,28.0625,78378400,17.1742286682129,1998-07-28
Date (MM/DD/YYYY): 07/29/1998,28.3125,28.5625,27.515625,27.671875,59738000,16.935173034668,1998-07-29
Date (MM/DD/YYYY): 07/30/1998,27.984375,28.40625,27.6875,28.359375,72746400,17.3559188842773,1998-07-30
Date (MM/DD/YYYY): 07/31/1998,28.234375,28.37890625,27.484375,27.484375,53705200,16.8204097747803,1998-07-31
Date (MM/DD/YYYY): 08/03/1998,27.28125,27.71875,26.84375,27.109375,73566400,16.5909252166748,1998-08-03
Date (MM/DD/YYYY): 08/04/1998,27.15625,27.40625,26.046875,26.125,91412000,15.9884824752808,1998-08-04
Date (MM/DD/YYYY): 08/05/1998,26.03125,26.5625,25.375,26.078125,120208800,15.9597940444946,1998-08-05
Date (MM/DD/YYYY): 08/06/1998,25.9375,26.734375,25.90625,26.71875,68308000,16.3518600463867,1998-08-06
Date (MM/DD/YYYY): 08/07/1998,26.859375,26.875,26.265625,26.46875,54972400,16.1988468170166,1998-08-07
Date (MM/DD/YYYY): 08/10/1998,26.453125,26.578125,26.109375,26.109375,46763200,15.9789161682129,1998-08-10
Date (MM/DD/YYYY): 08/11/1998,25.71875,26.09375,25.5,25.859375,60976400,15.8259181976318,1998-08-11
Date (MM/DD/YYYY): 08/12/1998,26.078125,26.296875,25.75,26.265625,53760000,16.0745449066162,1998-08-12
Date (MM/DD/YYYY): 08/13/1998,26.03125,26.5,25.9375,25.984375,51193200,15.9024152755737,1998-08-13
Date (MM/DD/YYYY): 08/14/1998,26.171875,26.265625,25.875,26.0625,29566400,15.950231552124,1998-08-14
Date (MM/DD/YYYY): 08/17/1998,25.875,26.84375,25.75,26.828125,54073200,16.4187889099121,1998-08-17
Date (MM/DD/YYYY): 08/18/1998,26.96875,27.953125,26.84375,27.8125,70591200,17.0212306976318,1998-08-18
Date (MM/DD/YYYY): 08/19/1998,28.0625,28.1875,27.5625,27.640625,55709600,16.9160480499268,1998-08-19
Date (MM/DD/YYYY): 08/20/1998,27.53125,28.1875,27.421875,28.140625,49970400,17.2220439910889,1998-08-20
Date (MM/DD/YYYY): 08/21/1998,27.78125,27.96875,27.1875,27.65625,59523600,16.925609588623,1998-08-21
Date (MM/DD/YYYY): 08/24/1998,27.578125,28.0,27.5,27.59375,26319200,16.8873538970947,1998-08-24
Date (MM/DD/YYYY): 08/25/1998,27.84375,28.421875,27.78125,28.203125,58026800,17.2602882385254,1998-08-25
Date (MM/DD/YYYY): 08/26/1998,27.8125,28.4375,27.71875,28.140625,44804400,17.2220439910889,1998-08-26
Date (MM/DD/YYYY): 08/27/1998,27.640625,28.1875,27.125,27.3125,74874000,16.7152233123779,1998-08-27
Date (MM/DD/YYYY): 08/28/1998,27.0625,27.40625,26.1875,26.3125,72730000,16.1032333374023,1998-08-28
Date (MM/DD/YYYY): 08/31/1998,26.21875,26.625,23.9375,23.984375,132690400,14.6784172058105,1998-08-31
Date (MM/DD/YYYY): 09/01/1998,23.8125,25.4375,23.625,25.3125,140112400,15.4912309646606,1998-09-01
Date (MM/DD/YYYY): 09/02/1998,25.453125,26.0625,25.0625,25.140625,63438400,15.3860397338867,1998-09-02
Date (MM/DD/YYYY): 09/03/1998,24.6875,25.1875,24.59375,24.8125,67506800,15.1852321624756,1998-09-03
Date (MM/DD/YYYY): 09/04/1998,24.921875,25.0625,24.03125,24.15625,50890400,14.7836036682129,1998-09-04
Date (MM/DD/YYYY): 09/08/1998,25.0,25.515625,24.765625,25.4921875,60625600,15.6012010574341,1998-09-08
Date (MM/DD/YYYY): 09/09/1998,25.5625,26.109375,25.40625,25.5625,65480800,15.6442365646362,1998-09-09
Date (MM/DD/YYYY): 09/10/1998,25.0,25.28125,24.671875,25.1875,60758000,15.4147262573242,1998-09-10
Date (MM/DD/YYYY): 09/11/1998,25.28125,26.15625,25.03125,26.0625,58989200,15.950231552124,1998-09-11
Date (MM/DD/YYYY): 09/14/1998,26.234375,26.765625,26.21875,26.5,45086800,16.2179889678955,1998-09-14
Date (MM/DD/YYYY): 09/15/1998,26.46875,27.109375,26.28125,27.078125,49367600,16.5717945098877,1998-09-15
Date (MM/DD/YYYY): 09/16/1998,26.96875,27.125,26.53125,27.046875,42886800,16.5526676177979,1998-09-16
Date (MM/DD/YYYY): 09/17/1998,26.328125,26.625,26.203125,26.234375,45178400,16.0554180145264,1998-09-17
Date (MM/DD/YYYY): 09/18/1998,26.4375,26.5625,26.078125,26.34375,47361600,16.1223526000977,1998-09-18
Date (MM/DD/YYYY): 09/21/1998,25.625,27.015625,25.59375,26.96875,45872000,16.5048599243164,1998-09-21
Date (MM/DD/YYYY): 09/22/1998,27.109375,27.46875,26.6875,27.296875,43082000,16.7056674957275,1998-09-22
Date (MM/DD/YYYY): 09/23/1998,27.40625,28.46875,27.125,28.40625,65263600,17.3846054077148,1998-09-23
Date (MM/DD/YYYY): 09/24/1998,28.28125,28.65625,27.25,27.53125,63521600,16.8491058349609,1998-09-24
Date (MM/DD/YYYY): 09/25/1998,27.28125,28.28125,27.15625,28.265625,47878400,17.2985420227051,1998-09-25
Date (MM/DD/YYYY): 09/28/1998,28.25,28.59375,27.4375,27.828125,41405200,17.0307960510254,1998-09-28
Date (MM/DD/YYYY): 09/29/1998,27.953125,28.5,27.84375,28.21875,48743200,17.2698535919189,1998-09-29
Date (MM/DD/YYYY): 09/30/1998,28.078125,28.390625,27.5078125,27.515625,38875600,16.8395385742188,1998-09-30
Date (MM/DD/YYYY): 10/01/1998,27.015625,27.375,26.0,26.015625,65442400,15.9215488433838,1998-10-01
Date (MM/DD/YYYY): 10/02/1998,25.84375,26.296875,25.25,26.03125,65889600,15.9311094284058,1998-10-02
Date (MM/DD/YYYY): 10/05/1998,25.625,25.71875,24.125,25.296875,114937600,15.4816694259644,1998-10-05
Date (MM/DD/YYYY): 10/06/1998,25.625,25.90625,24.34375,24.40625,76550000,14.9366035461426,1998-10-06
Date (MM/DD/YYYY): 10/07/1998,24.34375,24.9375,23.34375,23.53125,90710400,14.4011068344116,1998-10-07
Date (MM/DD/YYYY): 10/08/1998,22.640625,22.96875,21.9375,22.796875,144719200,13.9516658782959,1998-10-08
Date (MM/DD/YYYY): 10/09/1998,23.296875,24.25,23.0625,24.21875,72661600,14.8218593597412,1998-10-09
Date (MM/DD/YYYY): 10/12/1998,24.8125,25.25,24.625,24.9375,51502800,15.2617292404175,1998-10-12
Date (MM/DD/YYYY): 10/13/1998,24.875,24.9375,23.9375,24.109375,47995600,14.7549200057983,1998-10-13
Date (MM/DD/YYYY): 10/14/1998,23.96875,25.34375,23.96875,25.046875,62403200,15.3286685943604,1998-10-14
Date (MM/DD/YYYY): 10/15/1998,25.03125,26.40625,24.90625,26.359375,66253600,16.1319198608398,1998-10-15
Date (MM/DD/YYYY): 10/16/1998,26.5,26.625,26.0,26.265625,68620000,16.0745449066162,1998-10-16
Date (MM/DD/YYYY): 10/19/1998,26.03125,26.046875,25.28125,25.734375,60177600,15.7494220733643,1998-10-19
Date (MM/DD/YYYY): 10/20/1998,25.8125,25.84375,24.90625,25.0625,94368400,15.3382339477539,1998-10-20
Date (MM/DD/YYYY): 10/21/1998,26.21875,26.71875,25.765625,26.609375,125377200,16.2849197387695,1998-10-21
Date (MM/DD/YYYY): 10/22/1998,26.5,27.53125,26.3125,27.5,81910800,16.8299713134766,1998-10-22
Date (MM/DD/YYYY): 10/23/1998,27.25,27.5,26.546875,26.59375,59882000,16.2753467559814,1998-10-23
Date (MM/DD/YYYY): 10/26/1998,26.703125,27.0,26.421875,26.765625,59678400,16.3805465698242,1998-10-26
Date (MM/DD/YYYY): 10/27/1998,26.9375,26.96875,26.25,26.359375,65434800,16.1319198608398,1998-10-27
Date (MM/DD/YYYY): 10/28/1998,26.21875,26.65625,26.21875,26.421875,56808400,16.170166015625,1998-10-28
Date (MM/DD/YYYY): 10/29/1998,26.359375,26.875,26.359375,26.65625,52402800,16.313606262207,1998-10-29
Date (MM/DD/YYYY): 10/30/1998,26.8125,27.046875,26.28125,26.46875,59322800,16.1988468170166,1998-10-30
Date (MM/DD/YYYY): 11/02/1998,26.59375,26.71875,26.25,26.453125,48388400,16.1892929077148,1998-11-02
Date (MM/DD/YYYY): 11/03/1998,26.375,26.640625,26.1875,26.296875,36546800,16.0936679840088,1998-11-03
Date (MM/DD/YYYY): 11/04/1998,26.453125,26.828125,26.21875,26.375,67459600,16.1414852142334,1998-11-04
Date (MM/DD/YYYY): 11/05/1998,26.328125,26.90625,26.3125,26.59375,76727200,16.2753467559814,1998-11-05
Date (MM/DD/YYYY): 11/06/1998,26.515625,27.4375,26.484375,27.328125,74461200,16.7248001098633,1998-11-06
Date (MM/DD/YYYY): 11/09/1998,27.296875,27.84375,27.203125,27.671875,68956800,16.935173034668,1998-11-09
Date (MM/DD/YYYY): 11/10/1998,27.53125,28.359375,27.515625,28.015625,72075600,17.145544052124,1998-11-10
Date (MM/DD/YYYY): 11/11/1998,28.359375,28.6875,27.71875,27.765625,63899200,16.9925422668457,1998-11-11
Date (MM/DD/YYYY): 11/12/1998,27.5625,27.78125,27.125,27.1875,38526800,16.6387214660645,1998-11-12
Date (MM/DD/YYYY): 11/13/1998,27.109375,27.625,27.09375,27.5,28368800,16.8299713134766,1998-11-13
Date (MM/DD/YYYY): 11/16/1998,27.828125,27.9375,26.875,27.203125,42620400,16.6482944488525,1998-11-16
Date (MM/DD/YYYY): 11/17/1998,27.25,28.09375,27.234375,27.96875,58744000,17.1168594360352,1998-11-17
Date (MM/DD/YYYY): 11/18/1998,27.390625,27.765625,27.28125,27.4375,41691200,16.7917346954346,1998-11-18
Date (MM/DD/YYYY): 11/19/1998,27.265625,28.125,27.265625,27.9375,45220800,17.0977344512939,1998-11-19
Date (MM/DD/YYYY): 11/20/1998,28.1875,28.4375,27.8125,28.40625,48405200,17.3846054077148,1998-11-20
Date (MM/DD/YYYY): 11/23/1998,28.125,30.046875,28.125,29.796875,110870400,18.2356643676758,1998-11-23
Date (MM/DD/YYYY): 11/24/1998,29.671875,31.265625,29.65625,30.421875,101114800,18.6181659698486,1998-11-24
Date (MM/DD/YYYY): 11/25/1998,30.671875,31.09375,30.1875,31.0625,41394000,19.0102252960205,1998-11-25
Date (MM/DD/YYYY): 11/27/1998,31.28125,32.03125,31.078125,32.015625,26335600,19.5935401916504,1998-11-27
Date (MM/DD/YYYY): 11/30/1998,32.34375,32.56640625,30.484375,30.5,70900000,18.6659717559814,1998-11-30
Date (MM/DD/YYYY): 12/01/1998,30.0625,32.4375,30.03125,32.375,86330800,19.8134803771973,1998-12-01
Date (MM/DD/YYYY): 12/02/1998,32.296875,32.4375,31.375,31.6875,65759600,19.3927345275879,1998-12-02
Date (MM/DD/YYYY): 12/03/1998,31.71875,32.234375,30.5,30.53125,51426800,18.6850986480713,1998-12-03
Date (MM/DD/YYYY): 12/04/1998,31.234375,31.84375,31.0,31.84375,44352000,19.4883556365967,1998-12-04
Date (MM/DD/YYYY): 12/07/1998,31.921875,33.4375,31.6875,33.390625,89809200,20.435037612915,1998-12-07
Date (MM/DD/YYYY): 12/08/1998,33.21875,33.5625,32.4375,32.796875,77585200,20.0716667175293,1998-12-08
Date (MM/DD/YYYY): 12/09/1998,33.03125,33.453125,32.5,33.40625,44781600,20.4446067810059,1998-12-09
Date (MM/DD/YYYY): 12/10/1998,33.28125,33.65625,32.84375,32.890625,57015600,20.1290340423584,1998-12-10
Date (MM/DD/YYYY): 12/11/1998,32.75,33.671875,32.6875,33.5,51728800,20.5019760131836,1998-12-11
Date (MM/DD/YYYY): 12/14/1998,33.1875,33.4375,31.921875,31.984375,64077600,19.574426651001,1998-12-14
Date (MM/DD/YYYY): 12/15/1998,32.328125,33.0,32.3125,32.96875,51719600,20.1768550872803,1998-12-15
Date (MM/DD/YYYY): 12/16/1998,33.125,33.78125,32.28125,33.4375,60024000,20.4637222290039,1998-12-16
Date (MM/DD/YYYY): 12/17/1998,33.546875,33.71875,33.0625,33.59375,46963600,20.5593528747559,1998-12-17
Date (MM/DD/YYYY): 12/18/1998,33.75,34.5625,33.53125,34.453125,59648000,21.0852928161621,1998-12-18
Date (MM/DD/YYYY): 12/21/1998,34.65625,35.546875,34.4375,35.109375,48112000,21.4869136810303,1998-12-21
Date (MM/DD/YYYY): 12/22/1998,35.125,35.125,34.34375,34.609375,41350000,21.1809158325195,1998-12-22
Date (MM/DD/YYYY): 12/23/1998,35.09375,35.953125,34.84375,35.890625,34940000,21.965030670166,1998-12-23
Date (MM/DD/YYYY): 12/24/1998,35.90625,36.0,35.375,35.4375,13832400,21.6877250671387,1998-12-24
Date (MM/DD/YYYY): 12/28/1998,35.75,35.90625,35.375,35.59375,23636400,21.7833461761475,1998-12-28
Date (MM/DD/YYYY): 12/29/1998,35.640625,35.640625,34.90625,35.125,29651600,21.4964790344238,1998-12-29
Date (MM/DD/YYYY): 12/30/1998,35.21875,35.83984375,34.71875,34.75,34942800,21.266975402832,1998-12-30
Date (MM/DD/YYYY): 12/31/1998,34.796875,35.0,34.5,34.671875,23834400,21.2191734313965,1998-12-31
Date (MM/DD/YYYY): 01/04/1999,34.90234375,36.3125,34.84375,35.25,69305200,21.5729789733887,1999-01-04
Date (MM/DD/YYYY): 01/05/1999,35.46875,37.0,35.359375,36.625,64281600,22.414478302002,1999-01-05
Date (MM/DD/YYYY): 01/06/1999,37.375,37.875,36.6875,37.8125,69064800,23.1412239074707,1999-01-06
Date (MM/DD/YYYY): 01/07/1999,37.4375,37.65625,37.0625,37.625,51150400,23.0264682769775,1999-01-07
Date (MM/DD/YYYY): 01/08/1999,38.046875,38.125,36.75,37.46875,50244800,22.9308490753174,1999-01-08
Date (MM/DD/YYYY): 01/11/1999,37.71875,37.734375,36.0625,36.875,46463200,22.5674839019775,1999-01-11
Date (MM/DD/YYYY): 01/12/1999,37.03125,37.03125,35.25,35.546875,57907200,21.75465965271,1999-01-12
Date (MM/DD/YYYY): 01/13/1999,34.0,36.9375,34.0,35.953125,75346000,22.0032939910889,1999-01-13
Date (MM/DD/YYYY): 01/14/1999,36.3125,36.390625,35.375,35.4375,59214000,21.6877250671387,1999-01-14
Date (MM/DD/YYYY): 01/15/1999,35.734375,37.5,35.34375,37.4375,59344000,22.9117279052734,1999-01-15
Date (MM/DD/YYYY): 01/19/1999,37.84375,39.59375,37.71875,38.90625,102741600,23.8106002807617,1999-01-19
Date (MM/DD/YYYY): 01/20/1999,41.734375,41.9375,40.62109375,40.65625,125481200,24.8816013336182,1999-01-20
Date (MM/DD/YYYY): 01/21/1999,40.4375,40.828125,39.4375,39.578125,80077200,24.2217826843262,1999-01-21
Date (MM/DD/YYYY): 01/22/1999,38.90625,40.05859375,38.8125,39.0625,82160000,23.9062271118164,1999-01-22
Date (MM/DD/YYYY): 01/25/1999,40.421875,40.828125,39.78125,40.46875,103076400,24.7668476104736,1999-01-25
Date (MM/DD/YYYY): 01/26/1999,41.375,42.9375,41.125,42.890625,120203200,26.2490310668945,1999-01-26
Date (MM/DD/YYYY): 01/27/1999,43.125,43.609375,42.125,42.15625,98048000,25.7995948791504,1999-01-27
Date (MM/DD/YYYY): 01/28/1999,42.9375,43.515625,42.453125,43.5,78838400,26.6219692230225,1999-01-28
Date (MM/DD/YYYY): 01/29/1999,43.6875,43.78125,42.71875,43.75,79571600,26.7749652862549,1999-01-29
Date (MM/DD/YYYY): 02/01/1999,43.859375,43.984375,42.703125,43.234375,81729200,26.4594135284424,1999-02-01
Date (MM/DD/YYYY): 02/02/1999,43.125,43.140625,41.5625,41.90625,91965600,25.6465950012207,1999-02-02
Date (MM/DD/YYYY): 02/03/1999,41.59375,42.46875,41.5,41.703125,73749200,25.5222854614258,1999-02-03
Date (MM/DD/YYYY): 02/04/1999,42.03125,42.09375,39.71875,39.765625,89151600,24.3365383148193,1999-02-04
Date (MM/DD/YYYY): 02/05/1999,40.0625,40.40625,38.71875,40.0,127945200,24.4799690246582,1999-02-05
Date (MM/DD/YYYY): 02/08/1999,40.640625,41.390625,40.40625,41.3125,109866800,25.2832221984863,1999-02-08
Date (MM/DD/YYYY): 02/09/1999,41.234375,41.6875,39.9375,40.015625,77293600,24.489538192749,1999-02-09
Date (MM/DD/YYYY): 02/10/1999,39.96875,41.09375,39.65625,40.15625,73694000,24.5755977630615,1999-02-10
Date (MM/DD/YYYY): 02/11/1999,40.6875,40.96875,40.09375,40.6875,60366000,24.9007244110107,1999-02-11
Date (MM/DD/YYYY): 02/12/1999,40.421875,40.921875,39.28125,39.4375,62930400,24.1357192993164,1999-02-12
Date (MM/DD/YYYY): 02/16/1999,39.9375,39.96875,38.640625,39.0625,73666800,23.9062271118164,1999-02-16
Date (MM/DD/YYYY): 02/17/1999,38.234375,38.53125,37.125,37.5,101215600,22.9499778747559,1999-02-17
Date (MM/DD/YYYY): 02/18/1999,37.734375,37.84375,35.99609375,36.4375,117035200,22.299732208252,1999-02-18
Date (MM/DD/YYYY): 02/19/1999,36.859375,37.3125,36.4375,36.9375,73085600,22.6057243347168,1999-02-19
Date (MM/DD/YYYY): 02/22/1999,37.0625,37.25,36.1875,37.203125,92514400,22.76828956604,1999-02-22
Date (MM/DD/YYYY): 02/23/1999,38.234375,38.90625,37.625,38.859375,95106800,23.7819156646729,1999-02-23
Date (MM/DD/YYYY): 02/24/1999,39.109375,39.84375,38.1875,38.21875,67696800,23.3898429870605,1999-02-24
Date (MM/DD/YYYY): 02/25/1999,38.09375,38.4375,37.40625,38.375,70817200,23.4854774475098,1999-02-25
Date (MM/DD/YYYY): 02/26/1999,38.09375,38.125,37.375,37.53125,59273200,22.9690971374512,1999-02-26
Date (MM/DD/YYYY): 03/01/1999,37.390625,38.140625,37.375,37.9375,58332000,23.2177181243896,1999-03-01
Date (MM/DD/YYYY): 03/02/1999,37.96875,38.53125,36.90625,37.140625,58569600,22.730037689209,1999-03-02
Date (MM/DD/YYYY): 03/03/1999,37.25,37.671875,36.765625,37.40625,76798400,22.892599105835,1999-03-03
Date (MM/DD/YYYY): 03/04/1999,37.78125,38.375,37.03125,38.0625,61696400,23.2942295074463,1999-03-04
Date (MM/DD/YYYY): 03/05/1999,38.6875,38.84375,38.28125,38.734375,47302800,23.7054119110107,1999-03-05
Date (MM/DD/YYYY): 03/08/1999,38.875,39.80859375,38.75,39.75,46726000,24.3269710540771,1999-03-08
Date (MM/DD/YYYY): 03/09/1999,39.96875,41.1875,39.9375,40.453125,90129600,24.7572841644287,1999-03-09
Date (MM/DD/YYYY): 03/10/1999,40.578125,40.625,39.796875,40.34375,53114800,24.6903381347656,1999-03-10
Date (MM/DD/YYYY): 03/11/1999,40.25,41.140625,39.828125,40.359375,62948400,24.6998977661133,1999-03-11
Date (MM/DD/YYYY): 03/12/1999,40.65625,40.6875,39.203125,40.046875,73395200,24.5086536407471,1999-03-12
Date (MM/DD/YYYY): 03/15/1999,40.140625,41.5,39.46875,41.46875,60609600,25.3788452148438,1999-03-15
Date (MM/DD/YYYY): 03/16/1999,41.375,42.5,41.0625,42.265625,68554000,25.8665199279785,1999-03-16
Date (MM/DD/YYYY): 03/17/1999,42.265625,42.359375,41.6875,41.78125,44919600,25.5700931549072,1999-03-17
Date (MM/DD/YYYY): 03/18/1999,41.609375,43.140625,41.546875,43.109375,56231200,26.3829154968262,1999-03-18
Date (MM/DD/YYYY): 03/19/1999,43.46875,43.53125,42.46875,42.796875,91980400,26.1916637420654,1999-03-19
Date (MM/DD/YYYY): 03/22/1999,43.234375,43.734375,43.0,43.203125,55719200,26.4402847290039,1999-03-22
Date (MM/DD/YYYY): 03/23/1999,43.171875,43.53125,41.5625,41.640625,69581200,25.4840431213379,1999-03-23
Date (MM/DD/YYYY): 03/24/1999,41.75,42.953125,40.78125,42.8125,82634400,26.2012252807617,1999-03-24
Date (MM/DD/YYYY): 03/25/1999,43.265625,45.015625,43.125,44.984375,109447600,27.5304088592529,1999-03-25
Date (MM/DD/YYYY): 03/26/1999,44.734375,45.09375,43.9375,44.53125,94687600,27.2530918121338,1999-03-26
Date (MM/DD/YYYY): 03/29/1999,45.0625,46.3125,43.9375,46.1875,79777000,28.2667179107666,1999-03-29
Date (MM/DD/YYYY): 03/30/1999,46.6875,46.75,46.125,46.5,67502400,28.4579677581787,1999-03-30
Date (MM/DD/YYYY): 03/31/1999,47.25,47.3125,44.5625,44.8125,58752600,27.4252185821533,1999-03-31
Date (MM/DD/YYYY): 04/01/1999,45.625,46.4375,45.1328125,46.34375,41106000,28.3623447418213,1999-04-01
Date (MM/DD/YYYY): 04/05/1999,47.15625,47.5078125,46.75,47.46875,39848600,29.0508365631104,1999-04-05
Date (MM/DD/YYYY): 04/06/1999,47.59375,47.8125,46.625,47.03125,39674800,28.7830905914307,1999-04-06
Date (MM/DD/YYYY): 04/07/1999,47.4375,47.5,45.625,46.65625,46910200,28.5535869598389,1999-04-07
Date (MM/DD/YYYY): 04/08/1999,46.625,47.3125,45.5,47.28125,38637000,28.9360866546631,1999-04-08
Date (MM/DD/YYYY): 04/09/1999,47.125,47.5,46.5,47.125,31816800,28.8404712677002,1999-04-09
Date (MM/DD/YYYY): 04/12/1999,45.8125,46.8125,45.6875,46.5,37858800,28.4579677581787,1999-04-12
Date (MM/DD/YYYY): 04/13/1999,46.5625,46.5625,44.59375,45.0625,46746800,27.5782127380371,1999-04-13
Date (MM/DD/YYYY): 04/14/1999,45.40625,45.5625,42.9375,42.9375,52944000,26.2777233123779,1999-04-14
Date (MM/DD/YYYY): 04/15/1999,43.65625,44.9375,41.9375,44.4375,72594600,27.1957111358643,1999-04-15
Date (MM/DD/YYYY): 04/16/1999,44.53125,44.5625,42.9375,43.3125,44774000,26.5072154998779,1999-04-16
Date (MM/DD/YYYY): 04/19/1999,43.4375,44.0625,40.1875,40.5,75389000,24.7859706878662,1999-04-19
Date (MM/DD/YYYY): 04/20/1999,41.125,42.0,40.0,41.5625,108459400,25.436222076416,1999-04-20
Date (MM/DD/YYYY): 04/21/1999,41.0625,41.25,40.0,41.0,92732800,25.0919666290283,1999-04-21
Date (MM/DD/YYYY): 04/22/1999,42.5,42.625,41.6875,42.46875,55096400,25.9908447265625,1999-04-22
Date (MM/DD/YYYY): 04/23/1999,42.5,43.5,41.5,43.0,56592000,26.3159770965576,1999-04-23
Date (MM/DD/YYYY): 04/26/1999,43.59375,44.46875,43.375,44.0,48349800,26.9279766082764,1999-04-26
Date (MM/DD/YYYY): 04/27/1999,44.375,44.375,41.96875,42.0,58665800,25.7039794921875,1999-04-27
Date (MM/DD/YYYY): 04/28/1999,42.65625,43.25,40.859375,41.0625,55963400,25.1302242279053,1999-04-28
Date (MM/DD/YYYY): 04/29/1999,41.1875,41.84375,40.203125,41.03125,60880600,25.1110935211182,1999-04-29
Date (MM/DD/YYYY): 04/30/1999,41.375,41.875,39.9375,40.65625,58558600,24.8816013336182,1999-04-30
Date (MM/DD/YYYY): 05/03/1999,40.71875,40.75,39.28125,39.9375,67180000,24.4417209625244,1999-05-03
Date (MM/DD/YYYY): 05/04/1999,40.25,40.90625,38.875,39.03125,66502200,23.8870868682861,1999-05-04
Date (MM/DD/YYYY): 05/05/1999,39.5625,39.9375,38.21875,39.5625,67028200,24.212215423584,1999-05-05
Date (MM/DD/YYYY): 05/06/1999,40.34375,40.5625,38.75,38.96875,74021000,23.8488426208496,1999-05-06
Date (MM/DD/YYYY): 05/07/1999,39.8125,40.1875,39.0,39.53125,48011600,24.1930961608887,1999-05-07
Date (MM/DD/YYYY): 05/10/1999,39.9375,40.25,39.125,39.84375,46218000,24.3843421936035,1999-05-10
Date (MM/DD/YYYY): 05/11/1999,40.375,40.5078125,39.71875,39.9375,42786200,24.4417209625244,1999-05-11
Date (MM/DD/YYYY): 05/12/1999,40.375,40.5,39.625,40.25,60142600,24.632984161377,1999-05-12
Date (MM/DD/YYYY): 05/13/1999,40.5625,40.875,39.5625,39.5625,51737200,24.212215423584,1999-05-13
Date (MM/DD/YYYY): 05/14/1999,39.4375,39.96875,38.3125,38.4375,84401000,23.5237407684326,1999-05-14
Date (MM/DD/YYYY): 05/17/1999,38.6875,39.78125,38.5,39.5625,66850200,24.212215423584,1999-05-17
Date (MM/DD/YYYY): 05/18/1999,39.90625,40.125,38.96875,39.34375,63858400,24.07834815979,1999-05-18
Date (MM/DD/YYYY): 05/19/1999,39.9375,39.9375,38.625,39.65625,46510800,24.2696018218994,1999-05-19
Date (MM/DD/YYYY): 05/20/1999,39.78125,40.0,39.1875,39.21875,42386200,24.0018558502197,1999-05-20
Date (MM/DD/YYYY): 05/21/1999,39.25,39.5,38.5,38.78125,56568800,23.7340927124023,1999-05-21
Date (MM/DD/YYYY): 05/24/1999,38.9375,38.9375,38.03125,38.625,38990000,23.6384754180908,1999-05-24
Date (MM/DD/YYYY): 05/25/1999,38.375,39.625,38.0625,38.125,50791600,23.3324718475342,1999-05-25
Date (MM/DD/YYYY): 05/26/1999,38.59375,39.25,37.75,39.25,52022800,24.0209789276123,1999-05-26
Date (MM/DD/YYYY): 05/27/1999,39.125,39.71875,38.75,39.1875,56702200,23.9827365875244,1999-05-27
Date (MM/DD/YYYY): 05/28/1999,39.375,40.4375,39.0625,40.34375,41548000,24.6903381347656,1999-05-28
Date (MM/DD/YYYY): 06/01/1999,40.3125,40.375,39.21875,39.25,36046400,24.0209789276123,1999-06-01
Date (MM/DD/YYYY): 06/02/1999,39.03125,39.3125,38.125,39.21875,42812600,24.0018558502197,1999-06-02
Date (MM/DD/YYYY): 06/03/1999,39.1875,39.46875,38.0625,38.1875,32934400,23.370719909668,1999-06-03
Date (MM/DD/YYYY): 06/04/1999,38.46875,39.84375,38.375,39.78125,35668200,24.3460922241211,1999-06-04
Date (MM/DD/YYYY): 06/07/1999,39.96875,40.53125,39.59375,40.125,32392200,24.5564785003662,1999-06-07
Date (MM/DD/YYYY): 06/08/1999,39.9375,41.0625,39.5,39.6875,41516400,24.288724899292,1999-06-08
Date (MM/DD/YYYY): 06/09/1999,40.0625,41.3125,40.0,41.15625,53310800,25.1876029968262,1999-06-09
Date (MM/DD/YYYY): 06/10/1999,40.9375,41.15625,39.53125,39.9375,35277400,24.4417209625244,1999-06-10
Date (MM/DD/YYYY): 06/11/1999,40.0,40.25,38.78125,39.0625,34543000,23.9062271118164,1999-06-11
Date (MM/DD/YYYY): 06/14/1999,39.375,39.84375,38.71875,38.78125,28369800,23.7340927124023,1999-06-14
Date (MM/DD/YYYY): 06/15/1999,39.03125,39.4375,38.34375,38.84375,36981000,23.772346496582,1999-06-15
Date (MM/DD/YYYY): 06/16/1999,39.53125,40.8125,39.46875,40.5,48325200,24.7859706878662,1999-06-16
Date (MM/DD/YYYY): 06/17/1999,40.34375,41.5,40.25,41.4375,44475200,25.3597221374512,1999-06-17
Date (MM/DD/YYYY): 06/18/1999,41.15625,42.5,41.0625,42.5,69116200,26.0099601745605,1999-06-18
Date (MM/DD/YYYY): 06/21/1999,42.4375,44.5,42.4375,44.46875,56194400,27.2148475646973,1999-06-21
Date (MM/DD/YYYY): 06/22/1999,44.21875,44.21875,43.125,43.25,38751000,26.4689712524414,1999-06-22
Date (MM/DD/YYYY): 06/23/1999,42.96875,43.6875,42.53125,43.0,33942000,26.3159770965576,1999-06-23
Date (MM/DD/YYYY): 06/24/1999,42.875,43.125,42.0,42.3125,33559000,25.8952121734619,1999-06-24
Date (MM/DD/YYYY): 06/25/1999,42.6875,43.21875,42.1875,42.46875,24933000,25.9908447265625,1999-06-25
Date (MM/DD/YYYY): 06/28/1999,42.75,43.40625,42.46875,43.375,31701000,26.5454730987549,1999-06-28
Date (MM/DD/YYYY): 06/29/1999,43.34375,44.03125,43.0,44.0,38973200,26.9279766082764,1999-06-29
Date (MM/DD/YYYY): 06/30/1999,43.875,45.125,43.375,45.09375,57610200,27.5973281860352,1999-06-30
Date (MM/DD/YYYY): 07/01/1999,44.9375,45.75,44.1875,45.59375,47737800,27.9033317565918,1999-07-01
Date (MM/DD/YYYY): 07/02/1999,45.4375,46.0625,45.15625,46.0,32094800,28.151969909668,1999-07-02
Date (MM/DD/YYYY): 07/06/1999,46.125,46.46875,44.625,44.78125,45419400,27.406099319458,1999-07-06
Date (MM/DD/YYYY): 07/07/1999,45.03125,46.15625,44.9375,46.15625,33834600,28.2475967407227,1999-07-07
Date (MM/DD/YYYY): 07/08/1999,45.90625,46.5,45.34375,46.28125,37790400,28.3240928649902,1999-07-08
Date (MM/DD/YYYY): 07/09/1999,46.1875,46.65625,46.125,46.625,33884200,28.5344581604004,1999-07-09
Date (MM/DD/YYYY): 07/12/1999,46.59375,47.375,46.1875,47.09375,43847800,28.8213405609131,1999-07-12
Date (MM/DD/YYYY): 07/13/1999,46.5625,47.03125,46.40625,46.8125,30845000,28.6492233276367,1999-07-13
Date (MM/DD/YYYY): 07/14/1999,46.875,47.5,46.25,47.46875,37985200,29.0508365631104,1999-07-14
Date (MM/DD/YYYY): 07/15/1999,47.5,47.625,46.875,47.1875,40926200,28.8787117004395,1999-07-15
Date (MM/DD/YYYY): 07/16/1999,47.75,49.9375,47.5,49.71875,115369800,30.4278373718262,1999-07-16
Date (MM/DD/YYYY): 07/19/1999,50.0,50.375,48.90625,49.1875,81181600,30.1027145385742,1999-07-19
Date (MM/DD/YYYY): 07/20/1999,48.21875,48.375,46.15625,46.65625,92287400,28.5535869598389,1999-07-20
Date (MM/DD/YYYY): 07/21/1999,46.8125,47.65625,46.5,47.34375,54050800,28.97434425354,1999-07-21
Date (MM/DD/YYYY): 07/22/1999,47.1875,47.25,45.0,45.53125,60904200,27.8650932312012,1999-07-22
Date (MM/DD/YYYY): 07/23/1999,45.78125,45.875,44.84375,45.125,68833200,27.6164703369141,1999-07-23
Date (MM/DD/YYYY): 07/26/1999,44.4375,44.90625,43.8125,43.8125,50885000,26.8132171630859,1999-07-26
Date (MM/DD/YYYY): 07/27/1999,44.40625,44.875,44.0,44.40625,65513000,27.1765937805176,1999-07-27
Date (MM/DD/YYYY): 07/28/1999,44.59375,45.25,44.1875,45.0,62215200,27.5399627685547,1999-07-28
Date (MM/DD/YYYY): 07/29/1999,44.34375,44.40625,43.15625,43.46875,57968200,26.6028442382812,1999-07-29
Date (MM/DD/YYYY): 07/30/1999,43.8125,44.3125,42.75,42.90625,51127400,26.2585964202881,1999-07-30
Date (MM/DD/YYYY): 08/02/1999,42.84375,43.46875,42.1875,42.40625,48050600,25.9525909423828,1999-08-02
Date (MM/DD/YYYY): 08/03/1999,42.9375,43.03125,42.1875,42.375,55051200,25.9334621429443,1999-08-03
Date (MM/DD/YYYY): 08/04/1999,42.5625,43.59375,42.375,42.46875,75573400,25.9908447265625,1999-08-04
Date (MM/DD/YYYY): 08/05/1999,42.6875,43.1875,42.375,42.875,76634000,26.2394638061523,1999-08-05
Date (MM/DD/YYYY): 08/06/1999,43.03125,43.21875,42.46875,42.5625,67205800,26.0482234954834,1999-08-06
Date (MM/DD/YYYY): 08/09/1999,42.8125,42.90625,41.84375,41.90625,39333600,25.6465950012207,1999-08-09
Date (MM/DD/YYYY): 08/10/1999,41.78125,42.03125,40.8125,41.46875,62743000,25.3788452148438,1999-08-10
Date (MM/DD/YYYY): 08/11/1999,42.0,42.34375,41.15625,42.09375,66105200,25.7613563537598,1999-08-11
Date (MM/DD/YYYY): 08/12/1999,41.96875,42.09375,40.8125,40.875,61062000,25.0154724121094,1999-08-12
Date (MM/DD/YYYY): 08/13/1999,41.46875,42.8125,41.375,42.34375,65099800,25.9143371582031,1999-08-13
Date (MM/DD/YYYY): 08/16/1999,42.53125,42.9453125,41.15625,42.15625,57321800,25.7995948791504,1999-08-16
Date (MM/DD/YYYY): 08/17/1999,42.71875,42.75,41.46875,42.28125,51749000,25.8760852813721,1999-08-17
Date (MM/DD/YYYY): 08/18/1999,42.21875,43.09375,42.03125,42.5,58361200,26.0099601745605,1999-08-18
Date (MM/DD/YYYY): 08/19/1999,42.28125,42.5625,41.5625,41.90625,71478200,25.6465950012207,1999-08-19
Date (MM/DD/YYYY): 08/20/1999,42.0,42.390625,41.53125,41.6875,46072800,25.5127124786377,1999-08-20
Date (MM/DD/YYYY): 08/23/1999,42.15625,43.3125,41.9375,43.21875,60447000,26.4498519897461,1999-08-23
Date (MM/DD/YYYY): 08/24/1999,43.53125,46.75,43.53125,46.09375,120450000,28.2093410491943,1999-08-24
Date (MM/DD/YYYY): 08/25/1999,46.8125,48.0,46.59375,47.65625,81877600,29.1656036376953,1999-08-25
Date (MM/DD/YYYY): 08/26/1999,47.6875,48.1875,46.84375,47.3125,61246000,28.9552211761475,1999-08-26
Date (MM/DD/YYYY): 08/27/1999,47.53125,47.5625,46.1875,46.625,41948400,28.5344581604004,1999-08-27
Date (MM/DD/YYYY): 08/30/1999,46.4375,46.71875,45.78125,46.125,33300800,28.2284641265869,1999-08-30
Date (MM/DD/YYYY): 08/31/1999,45.90625,46.5625,45.0625,46.28125,46882800,28.3240928649902,1999-08-31
Date (MM/DD/YYYY): 09/01/1999,46.15625,46.71875,45.8125,46.1875,36607200,28.2667179107666,1999-09-01
Date (MM/DD/YYYY): 09/02/1999,45.75,46.28125,45.34375,45.90625,33340800,28.0945987701416,1999-09-02
Date (MM/DD/YYYY): 09/03/1999,46.875,48.21875,46.75,47.9375,52098000,29.3377017974854,1999-09-03
Date (MM/DD/YYYY): 09/07/1999,47.4375,48.34375,46.875,47.125,47028000,28.8404712677002,1999-09-07
Date (MM/DD/YYYY): 09/08/1999,46.84375,47.34375,46.03125,46.125,42568200,28.2284641265869,1999-09-08
Date (MM/DD/YYYY): 09/09/1999,46.21875,47.0703125,45.8984375,47.03125,38475200,28.7830905914307,1999-09-09
Date (MM/DD/YYYY): 09/10/1999,47.53125,47.65625,47.0,47.5,34455000,29.0699710845947,1999-09-10
Date (MM/DD/YYYY): 09/13/1999,47.25,47.40625,46.6875,46.9375,27870800,28.7257232666016,1999-09-13
Date (MM/DD/YYYY): 09/14/1999,46.84375,47.78125,46.8125,47.53125,40207800,29.0890827178955,1999-09-14
Date (MM/DD/YYYY): 09/15/1999,47.75,47.875,46.1875,46.3125,48413800,28.3432121276855,1999-09-15
Date (MM/DD/YYYY): 09/16/1999,46.4375,47.03125,45.3125,47.0,45796000,28.7639751434326,1999-09-16
Date (MM/DD/YYYY): 09/17/1999,47.1875,48.25,46.90625,48.21875,79773400,29.5098400115967,1999-09-17
Date (MM/DD/YYYY): 09/20/1999,48.0,48.9375,47.5,48.78125,48601800,29.8540782928467,1999-09-20
Date (MM/DD/YYYY): 09/21/1999,48.28125,48.28125,47.0625,47.3125,47082800,28.9552211761475,1999-09-21
Date (MM/DD/YYYY): 09/22/1999,47.375,48.3125,46.84375,48.03125,48531600,29.3950805664062,1999-09-22
Date (MM/DD/YYYY): 09/23/1999,48.4375,48.4375,45.0078125,45.59375,71073600,27.9033317565918,1999-09-23
Date (MM/DD/YYYY): 09/24/1999,45.09375,45.6875,44.4375,45.46875,70277000,27.8268413543701,1999-09-24
Date (MM/DD/YYYY): 09/27/1999,46.0,46.46875,45.4375,45.71875,34132200,27.9798431396484,1999-09-27
Date (MM/DD/YYYY): 09/28/1999,45.625,46.34375,44.53125,46.0625,46000600,28.1902160644531,1999-09-28
Date (MM/DD/YYYY): 09/29/1999,45.78125,46.0625,44.5625,44.75,37484400,27.3869686126709,1999-09-29
Date (MM/DD/YYYY): 09/30/1999,45.0,45.84375,44.40625,45.28125,47455400,27.7120914459229,1999-09-30
Date (MM/DD/YYYY): 10/01/1999,45.09375,45.3125,44.15625,44.9921875,44239000,27.5351791381836,1999-10-01
Date (MM/DD/YYYY): 10/04/1999,45.25,46.3125,45.125,46.28125,29998000,28.3240928649902,1999-10-04
Date (MM/DD/YYYY): 10/05/1999,46.375,46.9375,44.75,45.90625,43397000,28.0945987701416,1999-10-05
Date (MM/DD/YYYY): 10/06/1999,46.15625,47.0,46.03125,46.84375,35500200,28.6683406829834,1999-10-06
Date (MM/DD/YYYY): 10/07/1999,46.84375,47.53125,46.34375,46.875,46036400,28.6874752044678,1999-10-07
Date (MM/DD/YYYY): 10/08/1999,46.75,47.59375,46.0625,47.46875,35697000,29.0508365631104,1999-10-08
Date (MM/DD/YYYY): 10/11/1999,47.3125,47.5,47.0625,47.15625,19943800,28.8595924377441,1999-10-11
Date (MM/DD/YYYY): 10/12/1999,47.0,47.15625,46.1875,46.28125,27668600,28.3240928649902,1999-10-12
Date (MM/DD/YYYY): 10/13/1999,46.0,46.5625,45.15625,45.53125,38098400,27.8650932312012,1999-10-13
Date (MM/DD/YYYY): 10/14/1999,45.4375,46.1171875,44.84375,45.34375,42737800,27.7503414154053,1999-10-14
Date (MM/DD/YYYY): 10/15/1999,44.75,44.90625,43.65625,44.03125,73788000,26.9470806121826,1999-10-15
Date (MM/DD/YYYY): 10/18/1999,43.59375,44.0,42.53125,43.9375,75312800,26.8897304534912,1999-10-18
Date (MM/DD/YYYY): 10/19/1999,44.125,44.625,42.625,43.15625,69945600,26.4115982055664,1999-10-19
Date (MM/DD/YYYY): 10/20/1999,45.78125,46.1875,45.125,46.125,88090600,28.2284641265869,1999-10-20
Date (MM/DD/YYYY): 10/21/1999,45.28125,46.5625,45.25,46.53125,60801200,28.4770889282227,1999-10-21
Date (MM/DD/YYYY): 10/22/1999,46.78125,46.9375,45.875,46.34375,43650600,28.3623447418213,1999-10-22
Date (MM/DD/YYYY): 10/25/1999,46.0,46.78125,45.5625,46.21875,30492200,28.2858409881592,1999-10-25
Date (MM/DD/YYYY): 10/26/1999,47.1875,47.625,46.1328125,46.1875,52467600,28.2667179107666,1999-10-26
Date (MM/DD/YYYY): 10/27/1999,45.75,45.8125,44.84375,45.4375,54416600,27.8077163696289,1999-10-27
Date (MM/DD/YYYY): 10/28/1999,45.0,45.4375,44.65625,44.9375,70570400,27.50172996521,1999-10-28
Date (MM/DD/YYYY): 10/29/1999,45.71875,47.0,45.625,46.28125,79452600,28.3240928649902,1999-10-29
Date (MM/DD/YYYY): 11/01/1999,46.625,47.09375,46.0625,46.1875,53261200,28.2667179107666,1999-11-01
Date (MM/DD/YYYY): 11/02/1999,46.375,47.25,45.96875,46.28125,46349000,28.3240928649902,1999-11-02
Date (MM/DD/YYYY): 11/03/1999,46.46875,46.75,45.75,46.0,44517000,28.151969909668,1999-11-03
Date (MM/DD/YYYY): 11/04/1999,46.15625,46.375,45.15625,45.875,54239400,28.0754642486572,1999-11-04
Date (MM/DD/YYYY): 11/05/1999,45.90625,46.4375,45.25,45.78125,70167400,28.0181045532227,1999-11-05
Date (MM/DD/YYYY): 11/08/1999,42.40625,45.375,42.1875,44.96875,243819200,27.5208415985107,1999-11-08
Date (MM/DD/YYYY): 11/09/1999,44.875,44.9375,43.21875,44.4375,109769800,27.1957111358643,1999-11-09
Date (MM/DD/YYYY): 11/10/1999,44.0625,44.5625,43.21875,43.5625,69385400,26.6602096557617,1999-11-10
Date (MM/DD/YYYY): 11/11/1999,44.125,45.21875,44.125,44.8125,69274600,27.4252185821533,1999-11-11
Date (MM/DD/YYYY): 11/12/1999,44.875,45.0,43.53125,44.59375,49414200,27.2913475036621,1999-11-12
Date (MM/DD/YYYY): 11/15/1999,44.125,44.25,43.46875,43.5,47080400,26.6219692230225,1999-11-15
Date (MM/DD/YYYY): 11/16/1999,43.46875,43.875,42.9375,43.65625,59165200,26.7175788879395,1999-11-16
Date (MM/DD/YYYY): 11/17/1999,43.21875,43.53125,42.5,42.5,66819000,26.0099601745605,1999-11-17
Date (MM/DD/YYYY): 11/18/1999,42.46875,42.90625,42.25,42.46875,64493200,25.9908447265625,1999-11-18
Date (MM/DD/YYYY): 11/19/1999,42.21875,43.28125,42.1875,43.0,58226000,26.3159770965576,1999-11-19
Date (MM/DD/YYYY): 11/22/1999,44.8125,45.1875,44.21875,44.90625,90596600,27.4825954437256,1999-11-22
Date (MM/DD/YYYY): 11/23/1999,44.625,45.6875,44.1875,44.8125,70787400,27.4252185821533,1999-11-23
Date (MM/DD/YYYY): 11/24/1999,44.78125,46.125,44.75,45.84375,53771000,28.0563430786133,1999-11-24
Date (MM/DD/YYYY): 11/26/1999,45.8125,46.6875,45.5,45.5625,28514200,27.8842163085938,1999-11-26
Date (MM/DD/YYYY): 11/29/1999,45.0625,46.03125,44.75,45.09375,51460200,27.5973281860352,1999-11-29
Date (MM/DD/YYYY): 11/30/1999,44.875,46.4375,44.78125,45.5234375,64145600,27.8603057861328,1999-11-30
Date (MM/DD/YYYY): 12/01/1999,45.53125,46.96875,45.4375,46.59375,48864200,28.5153388977051,1999-12-01
Date (MM/DD/YYYY): 12/02/1999,46.53125,47.625,46.4375,47.40625,55473800,29.0125827789307,1999-12-02
Date (MM/DD/YYYY): 12/03/1999,47.90625,48.5625,47.8671875,48.0625,64100600,29.4142208099365,1999-12-03
Date (MM/DD/YYYY): 12/06/1999,47.625,48.59375,47.375,47.71875,49098200,29.2038516998291,1999-12-06
Date (MM/DD/YYYY): 12/07/1999,47.375,47.4375,46.4375,46.5,56859200,28.4579677581787,1999-12-07
Date (MM/DD/YYYY): 12/08/1999,46.5625,47.15625,45.84375,45.875,40955800,28.0754642486572,1999-12-08
Date (MM/DD/YYYY): 12/09/1999,46.0,46.65625,45.71875,46.375,46258200,28.3814678192139,1999-12-09
Date (MM/DD/YYYY): 12/10/1999,46.6875,47.0625,46.125,46.9375,36836000,28.7257232666016,1999-12-10
Date (MM/DD/YYYY): 12/13/1999,46.8046875,48.46875,46.375,48.3125,52691600,29.5672073364258,1999-12-13
Date (MM/DD/YYYY): 12/14/1999,48.09375,50.5625,47.65625,49.34375,144116200,30.1983375549316,1999-12-14
Date (MM/DD/YYYY): 12/15/1999,49.28125,54.375,49.25,54.21875,155571600,33.1818504333496,1999-12-15
Date (MM/DD/YYYY): 12/16/1999,54.625,57.5,54.46875,56.84375,128660200,34.7883338928223,1999-12-16
Date (MM/DD/YYYY): 12/17/1999,58.3125,58.5625,56.8125,57.625,105898800,35.2664604187012,1999-12-17
Date (MM/DD/YYYY): 12/20/1999,57.40625,57.5,55.59375,56.375,39433800,34.5014686584473,1999-12-20
Date (MM/DD/YYYY): 12/21/1999,56.1875,58.3125,55.3125,57.9375,57446000,35.4577140808105,1999-12-21
Date (MM/DD/YYYY): 12/22/1999,58.1484375,59.0,57.5625,58.78125,38565200,35.9740676879883,1999-12-22
Date (MM/DD/YYYY): 12/23/1999,58.625,59.625,58.375,58.71875,31028400,35.9358291625977,1999-12-23
Date (MM/DD/YYYY): 12/27/1999,59.21875,59.625,58.0625,59.5625,32202200,36.4522132873535,1999-12-27
Date (MM/DD/YYYY): 12/28/1999,59.375,59.40625,58.53125,58.75,24591000,35.954948425293,1999-12-28
Date (MM/DD/YYYY): 12/29/1999,58.46875,59.1875,58.40625,58.96875,17449200,36.0888366699219,1999-12-29
Date (MM/DD/YYYY): 12/30/1999,58.9375,59.96875,58.5625,58.8125,22360000,35.9932060241699,1999-12-30
Date (MM/DD/YYYY): 12/31/1999,58.75,58.875,58.125,58.375,12517600,35.7254486083984,1999-12-31
Date (MM/DD/YYYY): 01/03/2000,58.6875,59.3125,56.0,58.28125,53228400,35.6680755615234,2000-01-03
Date (MM/DD/YYYY): 01/04/2000,56.78125,58.5625,56.125,56.3125,54119000,34.463207244873,2000-01-04
Date (MM/DD/YYYY): 01/05/2000,55.5625,58.1875,54.6875,56.90625,64059600,34.8265838623047,2000-01-05
Date (MM/DD/YYYY): 01/06/2000,56.09375,56.9375,54.1875,55.0,54976600,33.6599426269531,2000-01-06
Date (MM/DD/YYYY): 01/07/2000,54.3125,56.125,53.65625,55.71875,62013600,34.0998344421387,2000-01-07
Date (MM/DD/YYYY): 01/10/2000,56.71875,56.84375,55.6875,56.125,44963600,34.3484573364258,2000-01-10
Date (MM/DD/YYYY): 01/11/2000,55.75,57.125,54.34375,54.6875,46743600,33.4687232971191,2000-01-11
Date (MM/DD/YYYY): 01/12/2000,54.25,54.4375,52.21875,52.90625,66532400,32.3785858154297,2000-01-12
Date (MM/DD/YYYY): 01/13/2000,52.1875,54.3125,50.75,53.90625,83144000,32.9905776977539,2000-01-13
Date (MM/DD/YYYY): 01/14/2000,53.59375,56.96875,52.875,56.125,73416400,34.3484573364258,2000-01-14
Date (MM/DD/YYYY): 01/18/2000,55.90625,58.25,55.875,57.65625,81483600,35.2855758666992,2000-01-18
Date (MM/DD/YYYY): 01/19/2000,55.25,55.75,53.0,53.5,97568200,32.7419586181641,2000-01-19
Date (MM/DD/YYYY): 01/20/2000,53.53125,54.84375,52.9375,53.0,56349800,32.435977935791,2000-01-20
Date (MM/DD/YYYY): 01/21/2000,53.5,53.625,51.625,51.875,68416200,31.7474727630615,2000-01-21
Date (MM/DD/YYYY): 01/24/2000,51.8984375,52.84375,50.40625,50.625,63597600,30.9824619293213,2000-01-24
Date (MM/DD/YYYY): 01/25/2000,50.5,51.9375,49.78125,51.40625,59823200,31.4605960845947,2000-01-25
Date (MM/DD/YYYY): 01/26/2000,51.21875,51.75,49.5625,49.6875,49365000,30.4087238311768,2000-01-26
Date (MM/DD/YYYY): 01/27/2000,49.9453125,50.59375,48.625,49.375,63654800,30.2174606323242,2000-01-27
Date (MM/DD/YYYY): 01/28/2000,49.0625,50.125,48.625,49.125,58225400,30.0644569396973,2000-01-28
Date (MM/DD/YYYY): 01/31/2000,48.8125,49.09375,47.4375,48.9375,73194200,29.9497146606445,2000-01-31
Date (MM/DD/YYYY): 02/01/2000,49.25,51.625,48.84375,51.46875,70196600,31.4988441467285,2000-02-01
Date (MM/DD/YYYY): 02/02/2000,51.21875,51.96875,50.25,50.40625,49915600,30.8485927581787,2000-02-02
Date (MM/DD/YYYY): 02/03/2000,51.03125,52.09375,50.0625,51.8125,49186000,31.7092056274414,2000-02-03
Date (MM/DD/YYYY): 02/04/2000,52.1875,54.0,52.0703125,53.28125,55365400,32.6080932617188,2000-02-04
Date (MM/DD/YYYY): 02/07/2000,53.40625,53.4375,52.125,53.3125,40005800,32.6272125244141,2000-02-07
Date (MM/DD/YYYY): 02/08/2000,53.21875,55.0,53.21875,54.96875,56229000,33.6408195495605,2000-02-08
Date (MM/DD/YYYY): 02/09/2000,54.71875,54.71875,51.9375,52.0,55090000,31.8239593505859,2000-02-09
Date (MM/DD/YYYY): 02/10/2000,51.9453125,53.28125,51.25,53.0,54527800,32.435977935791,2000-02-10
Date (MM/DD/YYYY): 02/11/2000,52.4375,52.4375,49.5625,49.96875,115559000,30.58083152771,2000-02-11
Date (MM/DD/YYYY): 02/14/2000,50.6171875,50.875,49.53125,49.8125,81028600,30.4852161407471,2000-02-14
Date (MM/DD/YYYY): 02/15/2000,49.875,50.0,49.0625,49.28125,71027600,30.1600952148438,2000-02-15
Date (MM/DD/YYYY): 02/16/2000,49.625,50.09375,48.5625,48.8125,65202600,29.8732070922852,2000-02-16
Date (MM/DD/YYYY): 02/17/2000,49.25,49.84375,48.5703125,49.8125,80343400,30.4852161407471,2000-02-17
Date (MM/DD/YYYY): 02/18/2000,50.0,50.03125,47.4375,47.53125,79063000,29.0890827178955,2000-02-18
Date (MM/DD/YYYY): 02/22/2000,47.5625,48.5625,46.40625,46.90625,66296200,28.7065811157227,2000-02-22
Date (MM/DD/YYYY): 02/23/2000,46.75,47.875,46.03125,47.125,75847200,28.8404712677002,2000-02-23
Date (MM/DD/YYYY): 02/24/2000,47.125,47.9375,46.0,47.375,69733200,28.9934692382812,2000-02-24
Date (MM/DD/YYYY): 02/25/2000,47.34375,47.3515625,45.25,45.65625,65301400,27.9416007995605,2000-02-25
Date (MM/DD/YYYY): 02/28/2000,45.125,46.0625,44.0625,45.78125,76131800,28.0181045532227,2000-02-28
Date (MM/DD/YYYY): 02/29/2000,45.875,45.875,44.4375,44.6875,58437400,27.3487243652344,2000-02-29
Date (MM/DD/YYYY): 03/01/2000,44.8125,47.046875,44.46875,45.40625,106889800,27.7885818481445,2000-03-01
Date (MM/DD/YYYY): 03/02/2000,45.90625,47.6875,45.5625,46.6875,106932600,28.5727195739746,2000-03-02
Date (MM/DD/YYYY): 03/03/2000,47.375,49.4375,46.9375,48.0625,101435200,29.4142208099365,2000-03-03
Date (MM/DD/YYYY): 03/06/2000,48.0,48.6875,45.0625,45.3125,93609400,27.7312240600586,2000-03-06
Date (MM/DD/YYYY): 03/07/2000,48.0625,48.75,45.96875,46.4375,135061000,28.4197158813477,2000-03-07
Date (MM/DD/YYYY): 03/08/2000,46.90625,48.09375,45.5,47.78125,94290000,29.242094039917,2000-03-08
Date (MM/DD/YYYY): 03/09/2000,47.65625,50.0,47.5,50.0,88198800,30.5999717712402,2000-03-09
Date (MM/DD/YYYY): 03/10/2000,49.78125,51.25,49.75,50.5,85589000,30.9059715270996,2000-03-10
Date (MM/DD/YYYY): 03/13/2000,48.8125,50.125,48.75,49.0,61831800,29.9879741668701,2000-03-13
Date (MM/DD/YYYY): 03/14/2000,49.3125,49.625,47.5625,47.5625,73489200,29.1082077026367,2000-03-14
Date (MM/DD/YYYY): 03/15/2000,47.28125,48.3125,46.84375,47.6875,53208000,29.1847362518311,2000-03-15
Date (MM/DD/YYYY): 03/16/2000,47.96875,48.34375,46.625,47.6875,77300800,29.1847362518311,2000-03-16
Date (MM/DD/YYYY): 03/17/2000,47.625,49.75,47.25,49.6875,81161600,30.4087238311768,2000-03-17
Date (MM/DD/YYYY): 03/20/2000,49.375,49.875,48.25,48.6875,47773000,29.7967224121094,2000-03-20
Date (MM/DD/YYYY): 03/21/2000,48.375,51.5625,48.25,51.375,81648800,31.4414653778076,2000-03-21
Date (MM/DD/YYYY): 03/22/2000,51.40625,52.8125,50.5625,51.625,93975800,31.5944557189941,2000-03-22
Date (MM/DD/YYYY): 03/23/2000,53.40625,56.4375,53.3125,55.9375,148224000,34.2337188720703,2000-03-23
Date (MM/DD/YYYY): 03/24/2000,56.3125,57.5,54.78125,55.84375,112196800,34.1763305664062,2000-03-24
Date (MM/DD/YYYY): 03/27/2000,53.8828125,54.125,51.96875,52.03125,111434000,31.8430976867676,2000-03-27
Date (MM/DD/YYYY): 03/28/2000,51.8125,53.71875,51.1875,52.15625,81114400,31.9195880889893,2000-03-28
Date (MM/DD/YYYY): 03/29/2000,52.59375,54.46875,52.5625,53.59375,64363800,32.7993278503418,2000-03-29
Date (MM/DD/YYYY): 03/30/2000,53.09375,54.3125,51.25,51.6875,64178400,31.6327228546143,2000-03-30
Date (MM/DD/YYYY): 03/31/2000,53.0,54.125,52.0625,53.125,64281400,32.5124626159668,2000-03-31
Date (MM/DD/YYYY): 04/03/2000,47.21875,48.25,45.0,45.4375,260118200,27.8077163696289,2000-04-03
Date (MM/DD/YYYY): 04/04/2000,45.78125,46.0,42.46875,44.28125,181244400,27.1000957489014,2000-04-04
Date (MM/DD/YYYY): 04/05/2000,44.125,44.25,42.9375,43.1875,82887600,26.4307136535645,2000-04-05
Date (MM/DD/YYYY): 04/06/2000,43.9375,44.0,42.6328125,43.0,66421400,26.3159770965576,2000-04-06
Date (MM/DD/YYYY): 04/07/2000,43.5,44.6875,42.5,44.53125,82613600,27.2530918121338,2000-04-07
Date (MM/DD/YYYY): 04/10/2000,44.3125,44.3125,43.0,43.03125,60685400,26.335090637207,2000-04-10
Date (MM/DD/YYYY): 04/11/2000,42.5625,43.03125,41.75,41.9375,71961800,25.6657199859619,2000-04-11
Date (MM/DD/YYYY): 04/12/2000,41.0625,41.125,39.375,39.6875,153003800,24.288724899292,2000-04-12
Date (MM/DD/YYYY): 04/13/2000,40.4375,41.125,39.5,39.625,94316200,24.2504692077637,2000-04-13
Date (MM/DD/YYYY): 04/14/2000,39.5625,39.75,36.625,37.0625,151217800,22.6822280883789,2000-04-14
Date (MM/DD/YYYY): 04/17/2000,37.125,38.0,36.5,37.9375,119772200,23.2177181243896,2000-04-17
Date (MM/DD/YYYY): 04/18/2000,38.25,40.96875,37.9375,40.28125,91794600,24.6520938873291,2000-04-18
Date (MM/DD/YYYY): 04/19/2000,40.71875,40.75,39.0625,39.34375,53715400,24.07834815979,2000-04-19
Date (MM/DD/YYYY): 04/20/2000,39.3125,39.9375,38.75,39.46875,52387400,24.1548500061035,2000-04-20
Date (MM/DD/YYYY): 04/24/2000,33.625,34.0,32.5,33.3125,313645800,20.3872222900391,2000-04-24
Date (MM/DD/YYYY): 04/25/2000,34.375,34.75,33.8125,34.6875,159517400,21.2287216186523,2000-04-25
Date (MM/DD/YYYY): 04/26/2000,35.0,35.5625,33.6875,34.0,107091200,20.8079776763916,2000-04-26
Date (MM/DD/YYYY): 04/27/2000,33.71875,34.96875,33.6875,34.90625,77669800,21.3625984191895,2000-04-27
Date (MM/DD/YYYY): 04/28/2000,35.375,35.5,34.125,34.875,78082600,21.3434829711914,2000-04-28
Date (MM/DD/YYYY): 05/01/2000,36.4375,37.0,35.84375,36.71875,107811000,22.4718570709229,2000-05-01
Date (MM/DD/YYYY): 05/02/2000,36.40625,36.75,34.75,34.9375,97716200,21.3817253112793,2000-05-02
Date (MM/DD/YYYY): 05/03/2000,35.1875,35.40625,34.40625,35.28125,55354800,21.5921020507812,2000-05-03
Date (MM/DD/YYYY): 05/04/2000,35.15625,35.625,34.65625,35.21875,43317200,21.5538482666016,2000-05-04
Date (MM/DD/YYYY): 05/05/2000,35.125,35.90625,34.9375,35.5625,36402200,21.7642288208008,2000-05-05
Date (MM/DD/YYYY): 05/08/2000,35.46875,35.6875,34.84375,34.90625,36187600,21.3625984191895,2000-05-08
Date (MM/DD/YYYY): 05/09/2000,35.09375,35.21875,33.75,33.90625,60778400,20.7506008148193,2000-05-09
Date (MM/DD/YYYY): 05/10/2000,33.875,33.9375,32.875,33.09375,67740000,20.2533512115479,2000-05-10
Date (MM/DD/YYYY): 05/11/2000,33.3125,34.0625,32.875,33.9375,58390800,20.7697200775146,2000-05-11
Date (MM/DD/YYYY): 05/12/2000,34.21875,34.875,34.125,34.40625,37886000,21.0566005706787,2000-05-12
Date (MM/DD/YYYY): 05/15/2000,34.5,34.71875,34.0,34.6875,33899600,21.2287216186523,2000-05-15
Date (MM/DD/YYYY): 05/16/2000,34.78125,35.3125,34.53125,34.75,48410600,21.266975402832,2000-05-16
Date (MM/DD/YYYY): 05/17/2000,34.4375,34.5625,33.625,33.84375,53242000,20.7123508453369,2000-05-17
Date (MM/DD/YYYY): 05/18/2000,34.03125,34.03125,32.9375,33.09375,53640400,20.2533512115479,2000-05-18
Date (MM/DD/YYYY): 05/19/2000,32.6875,32.96875,32.25,32.53125,66578000,19.9091033935547,2000-05-19
Date (MM/DD/YYYY): 05/22/2000,32.5625,32.625,31.21875,32.09375,69955000,19.6413497924805,2000-05-22
Date (MM/DD/YYYY): 05/23/2000,31.9375,32.78125,31.53125,31.59375,57963200,19.3353519439697,2000-05-23
Date (MM/DD/YYYY): 05/24/2000,31.5625,33.28125,31.5,32.78125,85482400,20.0621013641357,2000-05-24
Date (MM/DD/YYYY): 05/25/2000,32.28125,32.375,30.5625,30.75,94348800,18.8189849853516,2000-05-25
Date (MM/DD/YYYY): 05/26/2000,31.03125,31.3125,30.1875,30.71875,55822000,18.7998561859131,2000-05-26
Date (MM/DD/YYYY): 05/30/2000,31.21875,32.0625,31.0,31.6875,68536400,19.3927345275879,2000-05-30
Date (MM/DD/YYYY): 05/31/2000,31.8203125,31.8515625,31.03125,31.28125,54968200,19.1441097259521,2000-05-31
Date (MM/DD/YYYY): 06/01/2000,32.1875,33.0,31.90625,32.28125,94507200,19.756103515625,2000-06-01
Date (MM/DD/YYYY): 06/02/2000,33.0,33.375,32.5,33.15625,80463200,20.2915992736816,2000-06-02
Date (MM/DD/YYYY): 06/05/2000,33.0078125,34.1875,33.0,33.4375,64400000,20.4637222290039,2000-06-05
Date (MM/DD/YYYY): 06/06/2000,34.09375,34.9375,33.90625,34.8125,99019000,21.3052196502686,2000-06-06
Date (MM/DD/YYYY): 06/07/2000,34.625,35.375,33.5625,35.25,76310600,21.5729789733887,2000-06-07
Date (MM/DD/YYYY): 06/08/2000,35.78125,36.0625,34.125,34.40625,94765600,21.0566005706787,2000-06-08
Date (MM/DD/YYYY): 06/09/2000,34.8125,34.84375,34.15625,34.40625,35710200,21.0566005706787,2000-06-09
Date (MM/DD/YYYY): 06/12/2000,34.5,34.5,33.1875,33.4375,49260600,20.4637222290039,2000-06-12
Date (MM/DD/YYYY): 06/13/2000,33.375,34.0,33.0625,33.9375,44289200,20.7697200775146,2000-06-13
Date (MM/DD/YYYY): 06/14/2000,34.90625,35.5,34.75,35.25,79992400,21.5729789733887,2000-06-14
Date (MM/DD/YYYY): 06/15/2000,35.40625,36.34375,35.3125,36.1875,65592600,22.1467189788818,2000-06-15
Date (MM/DD/YYYY): 06/16/2000,36.3125,36.5625,35.75,36.28125,68710600,22.2041034698486,2000-06-16
Date (MM/DD/YYYY): 06/19/2000,36.28125,36.90625,36.0,36.84375,46604800,22.5483589172363,2000-06-19
Date (MM/DD/YYYY): 06/20/2000,36.9375,37.625,36.875,37.46875,62275000,22.9308490753174,2000-06-20
Date (MM/DD/YYYY): 06/21/2000,38.5,41.09375,38.46875,40.34375,160399600,24.6903381347656,2000-06-21
Date (MM/DD/YYYY): 06/22/2000,40.6875,41.0,39.65625,39.9375,87315200,24.4417209625244,2000-06-22
Date (MM/DD/YYYY): 06/23/2000,39.96875,40.03125,38.5,38.84375,49811600,23.772346496582,2000-06-23
Date (MM/DD/YYYY): 06/26/2000,38.75,40.0625,38.75,39.75,48287000,24.3269710540771,2000-06-26
Date (MM/DD/YYYY): 06/27/2000,39.625,40.0625,39.1875,39.40625,31071200,24.1165981292725,2000-06-27
Date (MM/DD/YYYY): 06/28/2000,39.5,40.03125,39.3125,39.46875,37459200,24.1548500061035,2000-06-28
Date (MM/DD/YYYY): 06/29/2000,39.125,39.46875,38.53125,38.59375,38449000,23.6193428039551,2000-06-29
Date (MM/DD/YYYY): 06/30/2000,38.53125,40.0,38.34375,40.0,52356400,24.4799690246582,2000-06-30
Date (MM/DD/YYYY): 07/03/2000,39.84375,40.03125,39.6875,40.0,15734800,24.4799690246582,2000-07-03
Date (MM/DD/YYYY): 07/05/2000,39.9375,39.9375,39.125,39.25,34824400,24.0209789276123,2000-07-05
Date (MM/DD/YYYY): 07/06/2000,39.4375,40.84375,39.25,40.46875,47873200,24.7668476104736,2000-07-06
Date (MM/DD/YYYY): 07/07/2000,40.6328125,41.4375,40.28125,41.0,54153200,25.0919666290283,2000-07-07
Date (MM/DD/YYYY): 07/10/2000,40.34375,40.65625,39.6875,39.71875,52689800,24.3078460693359,2000-07-10
Date (MM/DD/YYYY): 07/11/2000,39.40625,40.25,39.25,39.5625,37164800,24.212215423584,2000-07-11
Date (MM/DD/YYYY): 07/12/2000,39.125,40.5,38.59375,40.15625,58370200,24.5755977630615,2000-07-12
Date (MM/DD/YYYY): 07/13/2000,39.40625,40.0,38.6875,39.96875,80843200,24.4608383178711,2000-07-13
Date (MM/DD/YYYY): 07/14/2000,39.75,39.875,39.21875,39.46875,51180600,24.1548500061035,2000-07-14
Date (MM/DD/YYYY): 07/17/2000,39.125,39.78125,38.75,39.09375,53992800,23.9253540039062,2000-07-17
Date (MM/DD/YYYY): 07/18/2000,38.8125,39.75,38.71875,39.25,70617200,24.0209789276123,2000-07-18
Date (MM/DD/YYYY): 07/19/2000,38.03125,38.75,36.40625,36.5625,139924600,22.3762245178223,2000-07-19
Date (MM/DD/YYYY): 07/20/2000,36.71875,37.625,36.5625,37.40625,54690600,22.892599105835,2000-07-20
Date (MM/DD/YYYY): 07/21/2000,37.375,37.5,35.9375,36.15625,56100600,22.1276035308838,2000-07-21
Date (MM/DD/YYYY): 07/24/2000,36.03125,36.0625,35.0,35.28125,56165600,21.5921020507812,2000-07-24
Date (MM/DD/YYYY): 07/25/2000,35.40625,35.5,34.1875,34.5,64188600,21.1139698028564,2000-07-25
Date (MM/DD/YYYY): 07/26/2000,34.53125,34.75,33.625,33.90625,85404600,20.7506008148193,2000-07-26
Date (MM/DD/YYYY): 07/27/2000,33.9375,35.0625,33.75,34.6875,74337600,21.2287216186523,2000-07-27
Date (MM/DD/YYYY): 07/28/2000,35.46875,35.90625,34.8125,34.84375,75645600,21.3243560791016,2000-07-28
Date (MM/DD/YYYY): 07/31/2000,35.09375,35.5625,34.625,34.90625,70283800,21.3625984191895,2000-07-31
Date (MM/DD/YYYY): 08/01/2000,34.96875,35.03125,34.09375,34.34375,47163600,21.018346786499,2000-08-01
Date (MM/DD/YYYY): 08/02/2000,34.28125,35.21875,34.25,34.6875,48269200,21.2287216186523,2000-08-02
Date (MM/DD/YYYY): 08/03/2000,34.09375,35.1875,34.0625,35.125,54543400,21.4964790344238,2000-08-03
Date (MM/DD/YYYY): 08/04/2000,34.71875,34.9375,34.09375,34.5625,38107400,21.1522254943848,2000-08-04
Date (MM/DD/YYYY): 08/07/2000,35.09375,35.5625,34.875,35.0,52741800,21.4199752807617,2000-08-07
Date (MM/DD/YYYY): 08/08/2000,35.03125,37.34375,35.0,37.0625,138038800,22.6822280883789,2000-08-08
Date (MM/DD/YYYY): 08/09/2000,36.875,37.4375,36.5625,37.125,63945600,22.7204780578613,2000-08-09
Date (MM/DD/YYYY): 08/10/2000,36.90625,37.03125,35.875,36.3125,48986000,22.2232246398926,2000-08-10
Date (MM/DD/YYYY): 08/11/2000,36.21875,36.34375,35.8125,36.21875,35629600,22.1658458709717,2000-08-11
Date (MM/DD/YYYY): 08/14/2000,36.15625,36.6875,35.6875,36.09375,53427000,22.0893459320068,2000-08-14
Date (MM/DD/YYYY): 08/15/2000,36.0,36.5,35.75,35.8125,40714200,21.9172229766846,2000-08-15
Date (MM/DD/YYYY): 08/16/2000,35.9375,36.125,35.28125,35.5,44976200,21.7259731292725,2000-08-16
Date (MM/DD/YYYY): 08/17/2000,35.5625,36.0,35.28125,35.78125,36112800,21.8981018066406,2000-08-17
Date (MM/DD/YYYY): 08/18/2000,35.5625,35.71875,35.0,35.5,54438800,21.7259731292725,2000-08-18
Date (MM/DD/YYYY): 08/21/2000,35.34375,35.40625,35.03125,35.3125,34119600,21.6112232208252,2000-08-21
Date (MM/DD/YYYY): 08/22/2000,35.40625,36.21875,35.109375,35.625,54428200,21.8024749755859,2000-08-22
Date (MM/DD/YYYY): 08/23/2000,35.40625,35.5625,35.1875,35.375,36726800,21.6494750976562,2000-08-23
Date (MM/DD/YYYY): 08/24/2000,35.3125,35.59375,34.96875,35.5625,42405400,21.7642288208008,2000-08-24
Date (MM/DD/YYYY): 08/25/2000,35.34375,35.84375,35.28125,35.3125,52729400,21.6112232208252,2000-08-25
Date (MM/DD/YYYY): 08/28/2000,35.09375,36.0625,35.0625,35.65625,56421600,21.8215980529785,2000-08-28
Date (MM/DD/YYYY): 08/29/2000,35.59375,36.375,35.4375,35.46875,59400200,21.7068538665771,2000-08-29
Date (MM/DD/YYYY): 08/30/2000,35.34375,35.46875,34.84375,35.0,53498800,21.4199752807617,2000-08-30
Date (MM/DD/YYYY): 08/31/2000,35.4375,36.0,34.84375,34.90625,72575400,21.3625984191895,2000-08-31
Date (MM/DD/YYYY): 09/01/2000,35.0,35.3125,34.84375,35.09375,37629800,21.4773540496826,2000-09-01
Date (MM/DD/YYYY): 09/05/2000,35.0,35.34375,34.90625,35.0625,50755200,21.4582214355469,2000-09-05
Date (MM/DD/YYYY): 09/06/2000,35.03125,35.34375,34.65625,34.71875,62960800,21.2478485107422,2000-09-06
Date (MM/DD/YYYY): 09/07/2000,35.0,36.03125,34.71875,35.03125,111711200,21.4391002655029,2000-09-07
Date (MM/DD/YYYY): 09/08/2000,35.1875,35.4375,34.59375,34.65625,56709600,21.2096061706543,2000-09-08
Date (MM/DD/YYYY): 09/11/2000,34.5625,34.84375,34.03125,34.40625,48495200,21.0566005706787,2000-09-11
Date (MM/DD/YYYY): 09/12/2000,34.375,34.65625,33.8125,34.0625,46781200,20.8462238311768,2000-09-12
Date (MM/DD/YYYY): 09/13/2000,33.78125,34.375,33.59375,34.125,40744800,20.8844699859619,2000-09-13
Date (MM/DD/YYYY): 09/14/2000,34.34375,34.375,32.84375,32.90625,78503000,20.1386032104492,2000-09-14
Date (MM/DD/YYYY): 09/15/2000,32.71875,32.8125,31.65625,32.09375,99915200,19.6413497924805,2000-09-15
Date (MM/DD/YYYY): 09/18/2000,32.125,32.3125,31.09375,31.5,69037800,19.2779731750488,2000-09-18
Date (MM/DD/YYYY): 09/19/2000,31.8125,32.875,31.6875,32.5,79311200,19.8899784088135,2000-09-19
Date (MM/DD/YYYY): 09/20/2000,32.4375,32.5,31.59375,32.125,67791400,19.6604747772217,2000-09-20
Date (MM/DD/YYYY): 09/21/2000,32.0,32.5625,31.78125,32.09375,48952200,19.6413497924805,2000-09-21
Date (MM/DD/YYYY): 09/22/2000,30.5625,31.75,30.5,31.625,84476600,19.3544769287109,2000-09-22
Date (MM/DD/YYYY): 09/25/2000,31.625,31.75,30.21875,30.625,53484200,18.7424793243408,2000-09-25
Date (MM/DD/YYYY): 09/26/2000,30.46875,32.9375,30.21875,31.34375,155704800,19.18235206604,2000-09-26
Date (MM/DD/YYYY): 09/27/2000,31.71875,31.78125,29.90625,30.3125,106155600,18.5512199401855,2000-09-27
Date (MM/DD/YYYY): 09/28/2000,30.40625,30.9375,30.3125,30.65625,52360400,18.7616062164307,2000-09-28
Date (MM/DD/YYYY): 09/29/2000,30.5,30.65625,29.3125,30.15625,74053600,18.4556064605713,2000-09-29
Date (MM/DD/YYYY): 10/02/2000,30.25,30.40625,29.125,29.5625,58562400,18.0922260284424,2000-10-02
Date (MM/DD/YYYY): 10/03/2000,29.78125,29.90625,28.25,28.28125,85374000,17.3081169128418,2000-10-03
Date (MM/DD/YYYY): 10/04/2000,28.1875,28.28125,27.25,27.71875,136453400,16.9638576507568,2000-10-04
Date (MM/DD/YYYY): 10/05/2000,27.75,28.625,27.625,27.6875,81099400,16.9447326660156,2000-10-05
Date (MM/DD/YYYY): 10/06/2000,27.90625,28.375,27.375,27.78125,61794000,17.0021095275879,2000-10-06
Date (MM/DD/YYYY): 10/09/2000,27.8125,27.875,26.5,27.09375,58323600,16.581356048584,2000-10-09
Date (MM/DD/YYYY): 10/10/2000,26.96875,27.78125,26.90625,27.28125,62066200,16.6961097717285,2000-10-10
Date (MM/DD/YYYY): 10/11/2000,27.0,28.46875,27.0,27.875,101205800,17.0594844818115,2000-10-11
Date (MM/DD/YYYY): 10/12/2000,28.15625,28.4375,26.90625,27.1875,90219600,16.6387214660645,2000-10-12
Date (MM/DD/YYYY): 10/13/2000,26.9375,27.4375,26.0625,26.875,104521200,16.4474849700928,2000-10-13
Date (MM/DD/YYYY): 10/16/2000,26.75,26.90625,24.78125,25.1875,119759000,15.4147262573242,2000-10-16
Date (MM/DD/YYYY): 10/17/2000,25.9375,26.21875,25.125,25.21875,81276600,15.4338617324829,2000-10-17
Date (MM/DD/YYYY): 10/18/2000,24.8125,26.625,24.21875,25.875,110536400,15.8354740142822,2000-10-18
Date (MM/DD/YYYY): 10/19/2000,29.21875,31.09375,29.0,30.9375,256993200,18.9337291717529,2000-10-19
Date (MM/DD/YYYY): 10/20/2000,30.65625,33.0625,30.5625,32.59375,160378600,19.9473552703857,2000-10-20
Date (MM/DD/YYYY): 10/23/2000,32.3125,33.125,30.34375,31.0625,185170400,19.0102252960205,2000-10-23
Date (MM/DD/YYYY): 10/24/2000,31.3125,31.46875,30.09375,30.75,94427400,18.8189849853516,2000-10-24
Date (MM/DD/YYYY): 10/25/2000,30.96875,31.71875,30.21875,30.625,167603800,18.7424793243408,2000-10-25
Date (MM/DD/YYYY): 10/26/2000,30.5,32.53125,30.40625,32.21875,114826600,19.7178516387939,2000-10-26
Date (MM/DD/YYYY): 10/27/2000,32.34375,34.59375,32.3125,33.84375,124292400,20.7123508453369,2000-10-27
Date (MM/DD/YYYY): 10/30/2000,33.75,35.0625,33.6875,34.53125,110057600,21.1331043243408,2000-10-30
Date (MM/DD/YYYY): 10/31/2000,34.5,34.75,34.0,34.4375,104474000,21.0757255554199,2000-10-31
Date (MM/DD/YYYY): 11/01/2000,34.25,35.03125,34.21875,34.8125,81309400,21.3052196502686,2000-11-01
Date (MM/DD/YYYY): 11/02/2000,35.1875,35.421875,34.8125,35.15625,77985200,21.515604019165,2000-11-02
Date (MM/DD/YYYY): 11/03/2000,34.625,34.8125,34.03125,34.125,68711000,20.8844699859619,2000-11-03
Date (MM/DD/YYYY): 11/06/2000,34.34375,35.0625,34.125,34.75,74851400,21.266975402832,2000-11-06
Date (MM/DD/YYYY): 11/07/2000,34.875,35.9375,34.75,35.25,104331200,21.5729789733887,2000-11-07
Date (MM/DD/YYYY): 11/08/2000,35.5625,36.1875,34.0,34.71875,206149400,21.2478485107422,2000-11-08
Date (MM/DD/YYYY): 11/09/2000,34.25,35.65625,34.21875,35.4375,91058600,21.6877250671387,2000-11-09
Date (MM/DD/YYYY): 11/10/2000,34.96875,35.15625,33.40625,33.6875,93744400,20.616720199585,2000-11-10
Date (MM/DD/YYYY): 11/13/2000,33.34375,34.0625,32.203125,33.21875,83364800,20.32985496521,2000-11-13
Date (MM/DD/YYYY): 11/14/2000,34.0,34.90625,33.65625,34.40625,84218600,21.0566005706787,2000-11-14
Date (MM/DD/YYYY): 11/15/2000,34.53125,35.4375,34.34375,35.03125,60422200,21.4391002655029,2000-11-15
Date (MM/DD/YYYY): 11/16/2000,34.71875,35.75,34.46875,34.46875,92128600,21.0948505401611,2000-11-16
Date (MM/DD/YYYY): 11/17/2000,34.71875,35.0,33.8984375,34.53125,106525600,21.1331043243408,2000-11-17
Date (MM/DD/YYYY): 11/20/2000,34.0625,34.25,32.78125,33.59375,80157200,20.5593528747559,2000-11-20
Date (MM/DD/YYYY): 11/21/2000,33.6875,34.625,33.6875,33.875,59487600,20.7314758300781,2000-11-21
Date (MM/DD/YYYY): 11/22/2000,33.03125,34.75,33.0,34.125,76343200,20.8844699859619,2000-11-22
Date (MM/DD/YYYY): 11/24/2000,34.5,35.21875,34.25,34.96875,34439200,21.4008502960205,2000-11-24
Date (MM/DD/YYYY): 11/27/2000,35.71875,36.125,35.3125,35.34375,85307600,21.6303482055664,2000-11-27
Date (MM/DD/YYYY): 11/28/2000,34.6875,34.875,33.40625,33.5,127446200,20.5019760131836,2000-11-28
Date (MM/DD/YYYY): 11/29/2000,33.40625,33.5625,31.625,32.53125,98280400,19.9091033935547,2000-11-29
Date (MM/DD/YYYY): 11/30/2000,31.0,31.03125,28.5,28.6875,197200800,17.5567207336426,2000-11-30
Date (MM/DD/YYYY): 12/01/2000,29.03125,30.3125,28.03125,28.3125,109809800,17.3272342681885,2000-12-01
Date (MM/DD/YYYY): 12/04/2000,28.625,29.5,27.59375,28.21875,80407200,17.2698535919189,2000-12-04
Date (MM/DD/YYYY): 12/05/2000,29.59375,30.25,29.125,29.9375,101734400,18.3217315673828,2000-12-05
Date (MM/DD/YYYY): 12/06/2000,30.0,30.03125,28.03125,28.34375,90560800,17.3463497161865,2000-12-06
Date (MM/DD/YYYY): 12/07/2000,26.71875,27.0,26.125,26.5625,145308400,16.2562313079834,2000-12-07
Date (MM/DD/YYYY): 12/08/2000,27.3125,27.9375,26.71875,27.21875,120939800,16.6578559875488,2000-12-08
Date (MM/DD/YYYY): 12/11/2000,27.75,29.375,27.5,29.03125,95576200,17.7671070098877,2000-12-11
Date (MM/DD/YYYY): 12/12/2000,28.90625,30.0,28.375,29.1875,63106000,17.8627243041992,2000-12-12
Date (MM/DD/YYYY): 12/13/2000,30.25,30.25,28.40625,28.625,98360400,17.5184726715088,2000-12-13
Date (MM/DD/YYYY): 12/14/2000,28.96875,29.3671875,27.6875,27.75,71201400,16.9829845428467,2000-12-14
Date (MM/DD/YYYY): 12/15/2000,25.5234375,26.0,23.875,24.59375,116899800,15.0513572692871,2000-12-15
Date (MM/DD/YYYY): 12/18/2000,24.5,25.0,23.5,23.90625,107187400,14.6306095123291,2000-12-18
Date (MM/DD/YYYY): 12/19/2000,23.71875,24.0,22.25,22.40625,120271800,13.7126092910767,2000-12-19
Date (MM/DD/YYYY): 12/20/2000,21.40625,22.0,20.6875,20.75,149037800,12.6989822387695,2000-12-20
Date (MM/DD/YYYY): 12/21/2000,20.375,22.5625,20.15625,21.71875,163173000,13.2918672561646,2000-12-21
Date (MM/DD/YYYY): 12/22/2000,22.375,23.5625,22.375,23.21875,109551800,14.2098579406738,2000-12-22
Date (MM/DD/YYYY): 12/26/2000,23.4375,24.28125,22.9375,23.4375,66941600,14.3437376022339,2000-12-26
Date (MM/DD/YYYY): 12/27/2000,23.0625,23.40625,22.5,23.21875,69003800,14.2098579406738,2000-12-27
Date (MM/DD/YYYY): 12/28/2000,22.5625,23.125,21.9375,22.28125,77619200,13.6361103057861,2000-12-28
Date (MM/DD/YYYY): 12/29/2000,21.96875,22.90625,21.5,21.6875,99977600,13.2727365493774,2000-12-29
Date (MM/DD/YYYY): 01/02/2001,22.0625,22.5,21.4375,21.6875,82413200,13.2727365493774,2001-01-02
Date (MM/DD/YYYY): 01/03/2001,21.59375,24.4375,21.5625,23.96875,135962200,14.6688508987427,2001-01-03
Date (MM/DD/YYYY): 01/04/2001,23.90625,25.25,23.4375,24.21875,112397000,14.8218593597412,2001-01-04
Date (MM/DD/YYYY): 01/05/2001,24.25,24.9375,23.78125,24.5625,93414600,15.0322284698486,2001-01-05
Date (MM/DD/YYYY): 01/08/2001,24.46875,24.875,23.34375,24.46875,79817600,14.9748573303223,2001-01-08
Date (MM/DD/YYYY): 01/09/2001,25.0,26.3125,24.875,25.90625,114965400,15.8546028137207,2001-01-09
Date (MM/DD/YYYY): 01/10/2001,25.5,26.90625,25.375,26.4375,90230200,16.1797351837158,2001-01-10
Date (MM/DD/YYYY): 01/11/2001,26.5,27.875,26.15625,27.5,101854800,16.8299713134766,2001-01-11
Date (MM/DD/YYYY): 01/12/2001,27.4375,27.5,26.25,26.75,73712000,16.370979309082,2001-01-12
Date (MM/DD/YYYY): 01/16/2001,26.6875,26.75,25.5625,26.28125,68462400,16.0841007232666,2001-01-16
Date (MM/DD/YYYY): 01/17/2001,26.8125,27.4375,26.28125,26.46875,72844200,16.1988468170166,2001-01-17
Date (MM/DD/YYYY): 01/18/2001,26.84375,28.09375,26.3125,27.75,109788800,16.9829845428467,2001-01-18
Date (MM/DD/YYYY): 01/19/2001,30.0,30.71875,29.4375,30.5,209348800,18.6659717559814,2001-01-19
Date (MM/DD/YYYY): 01/22/2001,30.375,30.5,29.5,30.0625,76673000,18.3982334136963,2001-01-22
Date (MM/DD/YYYY): 01/23/2001,29.875,30.46875,29.46875,30.28125,70295200,18.5321083068848,2001-01-23
Date (MM/DD/YYYY): 01/24/2001,30.5,31.71875,30.375,31.46875,110455000,19.2588520050049,2001-01-24
Date (MM/DD/YYYY): 01/25/2001,31.375,32.0,30.78125,30.90625,85657400,18.914608001709,2001-01-25
Date (MM/DD/YYYY): 01/26/2001,30.5,32.15625,30.5,32.0,93080000,19.5839748382568,2001-01-26
Date (MM/DD/YYYY): 01/29/2001,31.78125,32.3125,31.75,32.25,84983800,19.7369728088379,2001-01-29
Date (MM/DD/YYYY): 01/30/2001,32.25,32.375,31.4375,31.6875,57276800,19.3927345275879,2001-01-30
Date (MM/DD/YYYY): 01/31/2001,31.5,31.875,30.5,30.53125,81898800,18.6850986480713,2001-01-31
Date (MM/DD/YYYY): 02/01/2001,30.40625,31.3125,30.1875,31.1875,71792800,19.0867233276367,2001-02-01
Date (MM/DD/YYYY): 02/02/2001,31.25,31.6875,30.375,30.40625,71100000,18.6086044311523,2001-02-02
Date (MM/DD/YYYY): 02/05/2001,30.375,31.03125,30.125,30.96875,51399200,18.952844619751,2001-02-05
Date (MM/DD/YYYY): 02/06/2001,31.03125,31.90625,30.84375,31.28125,96442000,19.1441097259521,2001-02-06
Date (MM/DD/YYYY): 02/07/2001,31.0,32.53125,30.90625,32.34375,126061800,19.7943572998047,2001-02-07
Date (MM/DD/YYYY): 02/08/2001,31.875,32.25,31.0,31.125,88041200,19.0484771728516,2001-02-08
Date (MM/DD/YYYY): 02/09/2001,30.65625,30.78125,29.25,29.5625,100575200,18.0922260284424,2001-02-09
Date (MM/DD/YYYY): 02/12/2001,29.40625,29.71875,28.59375,29.375,71289400,17.9774742126465,2001-02-12
Date (MM/DD/YYYY): 02/13/2001,29.8125,30.53125,29.0625,29.09375,76070600,17.8053493499756,2001-02-13
Date (MM/DD/YYYY): 02/14/2001,28.8125,29.5,28.1875,29.1875,61728400,17.8627243041992,2001-02-14
Date (MM/DD/YYYY): 02/15/2001,29.5,30.09375,28.9375,29.40625,65627800,17.996603012085,2001-02-15
Date (MM/DD/YYYY): 02/16/2001,28.5,29.125,28.0625,28.65625,66958400,17.5376052856445,2001-02-16
Date (MM/DD/YYYY): 02/20/2001,28.6875,29.125,27.6875,27.9375,60730800,17.0977344512939,2001-02-20
Date (MM/DD/YYYY): 02/21/2001,27.625,29.03125,27.59375,28.125,63947200,17.2124767303467,2001-02-21
Date (MM/DD/YYYY): 02/22/2001,28.15625,28.40625,26.9375,27.59375,100816400,16.8873538970947,2001-02-22
Date (MM/DD/YYYY): 02/23/2001,27.21875,28.75,27.15625,28.375,92620600,17.3654842376709,2001-02-23
Date (MM/DD/YYYY): 02/26/2001,28.8125,29.96875,28.6875,29.78125,87936800,18.2261066436768,2001-02-26
Date (MM/DD/YYYY): 02/27/2001,29.6875,30.59375,29.3359375,29.6875,99148600,18.1687278747559,2001-02-27
Date (MM/DD/YYYY): 02/28/2001,29.78125,30.0390625,29.09375,29.5,84608400,18.0539798736572,2001-02-28
Date (MM/DD/YYYY): 03/01/2001,29.28125,29.75,28.125,29.6796875,81781600,18.1639461517334,2001-03-01
Date (MM/DD/YYYY): 03/02/2001,28.75,29.0625,28.21875,28.34375,79800800,17.3463497161865,2001-03-02
Date (MM/DD/YYYY): 03/05/2001,28.625,29.3125,28.28125,28.71875,49383600,17.5758476257324,2001-03-05
Date (MM/DD/YYYY): 03/06/2001,29.3125,30.0,29.1875,29.71875,66781800,18.1878547668457,2001-03-06
Date (MM/DD/YYYY): 03/07/2001,29.9375,30.5625,29.65625,30.34375,59743600,18.5703506469727,2001-03-07
Date (MM/DD/YYYY): 03/08/2001,30.15625,30.296875,29.21875,29.625,54626000,18.130485534668,2001-03-08
Date (MM/DD/YYYY): 03/09/2001,28.96875,29.09375,27.4375,28.34375,103794400,17.3463497161865,2001-03-09
Date (MM/DD/YYYY): 03/12/2001,27.34375,27.5,25.8125,25.96875,114376000,15.8928604125977,2001-03-12
Date (MM/DD/YYYY): 03/13/2001,26.09375,27.375,26.0,27.09375,91035600,16.581356048584,2001-03-13
Date (MM/DD/YYYY): 03/14/2001,26.25,27.625,26.09375,27.0,90686200,16.523983001709,2001-03-14
Date (MM/DD/YYYY): 03/15/2001,27.65625,28.0390625,26.75,26.84375,71638400,16.428352355957,2001-03-15
Date (MM/DD/YYYY): 03/16/2001,26.25,27.5625,26.2421875,27.28125,112848800,16.6961097717285,2001-03-16
Date (MM/DD/YYYY): 03/19/2001,27.25,27.75,26.5625,27.15625,61036400,16.6196136474609,2001-03-19
Date (MM/DD/YYYY): 03/20/2001,27.28125,28.0625,26.3125,26.34375,91822800,16.1223526000977,2001-03-20
Date (MM/DD/YYYY): 03/21/2001,26.125,26.625,24.875,25.03125,124988600,15.3191089630127,2001-03-21
Date (MM/DD/YYYY): 03/22/2001,25.28125,27.03125,25.25,27.0,126363200,16.523983001709,2001-03-22
Date (MM/DD/YYYY): 03/23/2001,27.46875,28.5,27.1875,28.28125,99519600,17.3081169128418,2001-03-23
Date (MM/DD/YYYY): 03/26/2001,28.5625,28.75,27.78125,28.03125,63118600,17.1551094055176,2001-03-26
Date (MM/DD/YYYY): 03/27/2001,28.03125,29.28125,27.9375,29.125,95135600,17.8244762420654,2001-03-27
Date (MM/DD/YYYY): 03/28/2001,28.6875,28.96875,27.6875,27.78125,78681600,17.0021095275879,2001-03-28
Date (MM/DD/YYYY): 03/29/2001,27.6875,28.59375,27.28125,27.6875,86985000,16.9447326660156,2001-03-29
Date (MM/DD/YYYY): 03/30/2001,27.875,28.09375,26.9375,27.34375,91201600,16.7343616485596,2001-03-30
Date (MM/DD/YYYY): 04/02/2001,27.40625,28.46875,27.3125,27.90625,75924000,17.0786037445068,2001-04-02
Date (MM/DD/YYYY): 04/03/2001,27.65625,27.65625,26.375,26.6875,94187600,16.3327293395996,2001-04-03
Date (MM/DD/YYYY): 04/04/2001,26.6875,27.5,25.53125,25.96875,104046600,15.8928604125977,2001-04-04
Date (MM/DD/YYYY): 04/05/2001,26.875,28.6875,26.75,28.375,113364000,17.3654842376709,2001-04-05
Date (MM/DD/YYYY): 04/06/2001,28.1875,28.59375,27.53125,28.09375,92622000,17.1933555603027,2001-04-06
Date (MM/DD/YYYY): 04/09/2001,28.2849998474121,28.7099990844727,27.8299999237061,28.5750007629395,56295600,17.4878807067871,2001-04-09
Date (MM/DD/YYYY): 04/10/2001,28.9750003814697,30.0450000762939,28.8899993896484,29.8400001525879,109199400,18.2620620727539,2001-04-10
Date (MM/DD/YYYY): 04/11/2001,30.3250007629395,30.75,29.8500003814697,30.0200004577637,109879600,18.372220993042,2001-04-11
Date (MM/DD/YYYY): 04/12/2001,29.7800006866455,31.1550006866455,29.6749992370605,31.0900001525879,87520000,19.0270500183105,2001-04-12
Date (MM/DD/YYYY): 04/16/2001,30.7000007629395,30.7900009155273,30.0599994659424,30.3950004577637,65857400,18.6017169952393,2001-04-16
Date (MM/DD/YYYY): 04/17/2001,30.2600002288818,31.0550003051758,30.0200004577637,30.7399997711182,85149200,18.8128547668457,2001-04-17
Date (MM/DD/YYYY): 04/18/2001,31.6949996948242,33.1549987792969,31.5,32.7150001525879,156696400,20.0215587615967,2001-04-18
Date (MM/DD/YYYY): 04/19/2001,32.9049987792969,34.5,32.875,34.0200004577637,159375600,20.820219039917,2001-04-19
Date (MM/DD/YYYY): 04/20/2001,35.1500015258789,35.5499992370605,34.25,34.5,192919600,21.1139698028564,2001-04-20
Date (MM/DD/YYYY): 04/23/2001,34.0550003051758,34.2350006103516,33.4500007629395,34.125,92171200,20.8844699859619,2001-04-23
Date (MM/DD/YYYY): 04/24/2001,34.0999984741211,34.9650001525879,33.5699996948242,33.7750015258789,89176600,20.6702747344971,2001-04-24
Date (MM/DD/YYYY): 04/25/2001,33.7849998474121,34.8950004577637,33.625,34.8450012207031,76744000,21.3251113891602,2001-04-25
Date (MM/DD/YYYY): 04/26/2001,35.0349998474121,35.5,34.125,34.564998626709,118737600,21.1537532806396,2001-04-26
Date (MM/DD/YYYY): 04/27/2001,34.7649993896484,34.8400001525879,33.1049995422363,33.560001373291,121572400,20.538703918457,2001-04-27
Date (MM/DD/YYYY): 04/30/2001,34.2649993896484,34.5299987792969,33.8400001525879,33.875,74368200,20.7314758300781,2001-04-30
Date (MM/DD/YYYY): 05/01/2001,33.8300018310547,35.1500015258789,33.7999992370605,35.0849990844727,83702800,21.471996307373,2001-05-01
Date (MM/DD/YYYY): 05/02/2001,35.5,35.5750007629395,34.6749992370605,34.8800010681152,92864400,21.3465270996094,2001-05-02
Date (MM/DD/YYYY): 05/03/2001,34.625,35.0900001525879,34.0699996948242,34.2649993896484,66273400,20.9701671600342,2001-05-03
Date (MM/DD/YYYY): 05/04/2001,34.0,35.5250015258789,33.9799995422363,35.375,119538400,21.6494750976562,2001-05-04
Date (MM/DD/YYYY): 05/07/2001,35.4150009155273,36.0750007629395,35.3499984741211,35.689998626709,109356200,21.8422660827637,2001-05-07
Date (MM/DD/YYYY): 05/08/2001,35.875,36.0499992370605,35.375,36.0299987792969,75084000,22.0503330230713,2001-05-08
Date (MM/DD/YYYY): 05/09/2001,35.6199989318848,35.6500015258789,34.9300003051758,35.2000007629395,76676600,21.5423755645752,2001-05-09
Date (MM/DD/YYYY): 05/10/2001,35.564998626709,35.6199989318848,34.9799995422363,35.0,64334600,21.4199752807617,2001-05-10
Date (MM/DD/YYYY): 05/11/2001,34.9799995422363,35.0,34.3250007629395,34.7000007629395,51128800,21.2363700866699,2001-05-11
Date (MM/DD/YYYY): 05/14/2001,34.564998626709,34.5999984741211,34.1500015258789,34.3600006103516,44968000,21.0282936096191,2001-05-14
Date (MM/DD/YYYY): 05/15/2001,34.3699989318848,34.6500015258789,34.0,34.1349983215332,61385600,20.890588760376,2001-05-15
Date (MM/DD/YYYY): 05/16/2001,33.8499984741211,34.939998626709,33.6650009155273,34.5800018310547,91893800,21.1629276275635,2001-05-16
Date (MM/DD/YYYY): 05/17/2001,34.5499992370605,35.0699996948242,33.7750015258789,34.0849990844727,106984800,20.8599967956543,2001-05-17
Date (MM/DD/YYYY): 05/18/2001,33.8450012207031,34.5999984741211,33.625,34.0449981689453,90605400,20.8355197906494,2001-05-18
Date (MM/DD/YYYY): 05/21/2001,34.0250015258789,34.9949989318848,33.875,34.3950004577637,103491600,21.0497131347656,2001-05-21
Date (MM/DD/YYYY): 05/22/2001,34.7249984741211,35.1749992370605,34.5900001525879,35.1549987792969,83455600,21.5148258209229,2001-05-22
Date (MM/DD/YYYY): 05/23/2001,35.1949996948242,35.7999992370605,34.7550010681152,34.8499984741211,93637400,21.3281650543213,2001-05-23
Date (MM/DD/YYYY): 05/24/2001,34.9700012207031,35.8899993896484,34.6349983215332,35.8600006103516,80781600,21.9462985992432,2001-05-24
Date (MM/DD/YYYY): 05/25/2001,35.8300018310547,35.9500007629395,35.1800003051758,35.4550018310547,52747600,21.6984310150146,2001-05-25
Date (MM/DD/YYYY): 05/29/2001,35.4000015258789,35.875,35.0250015258789,35.1699981689453,71210800,21.5240039825439,2001-05-29
Date (MM/DD/YYYY): 05/30/2001,34.7799987792969,35.2900009155273,34.3250007629395,34.5950012207031,86501800,21.1721115112305,2001-05-30
Date (MM/DD/YYYY): 05/31/2001,34.7449989318848,35.189998626709,34.2000007629395,34.5900001525879,70682600,21.1690521240234,2001-05-31
Date (MM/DD/YYYY): 06/01/2001,34.7999992370605,35.3499984741211,34.3499984741211,35.1699981689453,57587600,21.5240039825439,2001-06-01
Date (MM/DD/YYYY): 06/04/2001,35.2750015258789,35.5099983215332,34.9000015258789,35.3899993896484,43736600,21.658655166626,2001-06-04
Date (MM/DD/YYYY): 06/05/2001,35.3800010681152,36.5400009155273,35.25,36.2999992370605,89454200,22.2155666351318,2001-06-05
Date (MM/DD/YYYY): 06/06/2001,36.4449996948242,36.7400016784668,35.7750015258789,36.1800003051758,80022800,22.1421337127686,2001-06-06
Date (MM/DD/YYYY): 06/07/2001,36.060001373291,36.8650016784668,36.0400009155273,36.8400001525879,66960000,22.5460548400879,2001-06-07
Date (MM/DD/YYYY): 06/08/2001,36.8499984741211,36.875,36.0250015258789,36.5950012207031,51867000,22.3961124420166,2001-06-08
Date (MM/DD/YYYY): 06/11/2001,36.4249992370605,36.4249992370605,35.7550010681152,36.060001373291,47345600,22.0686931610107,2001-06-11
Date (MM/DD/YYYY): 06/12/2001,35.5099983215332,36.2050018310547,35.4049987792969,36.0400009155273,66714600,22.0564594268799,2001-06-12
Date (MM/DD/YYYY): 06/13/2001,36.0250015258789,36.1500015258789,35.3199996948242,35.3450012207031,55302400,21.6311206817627,2001-06-13
Date (MM/DD/YYYY): 06/14/2001,35.1100006103516,35.2750015258789,34.2000007629395,34.4500007629395,71972400,21.0833835601807,2001-06-14
Date (MM/DD/YYYY): 06/15/2001,33.7550010681152,34.1500015258789,33.2000007629395,34.0099983215332,108354400,20.8141002655029,2001-06-15
Date (MM/DD/YYYY): 06/18/2001,33.9749984741211,33.9799995422363,33.0050010681152,33.439998626709,56846800,20.4652576446533,2001-06-18
Date (MM/DD/YYYY): 06/19/2001,34.1049995422363,34.4249992370605,33.4249992370605,33.6599998474121,63457400,20.5998992919922,2001-06-19
Date (MM/DD/YYYY): 06/20/2001,33.5699996948242,34.7949981689453,33.5499992370605,34.7050018310547,64108400,21.2394313812256,2001-06-20
Date (MM/DD/YYYY): 06/21/2001,34.5750007629395,35.2750015258789,34.4599990844727,34.9199981689453,69603800,21.3710155487061,2001-06-21
Date (MM/DD/YYYY): 06/22/2001,35.0,35.3050003051758,34.2900009155273,34.4150009155273,51092000,21.0619525909424,2001-06-22
Date (MM/DD/YYYY): 06/25/2001,34.5499992370605,34.9049987792969,33.8849983215332,34.4249992370605,49215600,21.0680751800537,2001-06-25
Date (MM/DD/YYYY): 06/26/2001,33.9099998474121,35.1049995422363,33.8499984741211,35.0699996948242,63077000,21.4628143310547,2001-06-26
Date (MM/DD/YYYY): 06/27/2001,34.9300003051758,35.7649993896484,34.6800003051758,35.5699996948242,69199800,21.7688064575195,2001-06-27
Date (MM/DD/YYYY): 06/28/2001,35.7750015258789,38.0750007629395,35.2649993896484,36.3699989318848,128975600,22.2584056854248,2001-06-28
Date (MM/DD/YYYY): 06/29/2001,36.2999992370605,36.7050018310547,35.7000007629395,36.5,94283800,22.3379821777344,2001-06-29
Date (MM/DD/YYYY): 07/02/2001,36.0250015258789,36.5750007629395,35.0750007629395,35.2999992370605,72810200,21.6035671234131,2001-07-02
Date (MM/DD/YYYY): 07/03/2001,35.1500015258789,35.4000015258789,34.9650001525879,35.2350006103516,28037400,21.5637893676758,2001-07-03
Date (MM/DD/YYYY): 07/05/2001,35.1100006103516,35.3600006103516,34.2200012207031,34.2550010681152,49242600,20.9640312194824,2001-07-05
Date (MM/DD/YYYY): 07/06/2001,34.1500015258789,34.2000007629395,32.8349990844727,33.0299987792969,67467800,20.2143268585205,2001-07-06
Date (MM/DD/YYYY): 07/09/2001,33.0999984741211,33.4550018310547,32.5200004577637,32.8450012207031,66476600,20.1011180877686,2001-07-09
Date (MM/DD/YYYY): 07/10/2001,32.9500007629395,33.125,32.1749992370605,32.2400016784668,66562600,19.7308521270752,2001-07-10
Date (MM/DD/YYYY): 07/11/2001,32.1049995422363,33.375,32.0999984741211,33.25,73822600,20.3489818572998,2001-07-11
Date (MM/DD/YYYY): 07/12/2001,35.3499984741211,36.0250015258789,35.1650009155273,35.7999992370605,128078000,21.9095859527588,2001-07-12
Date (MM/DD/YYYY): 07/13/2001,35.7000007629395,36.0,35.4700012207031,35.6699981689453,58934600,21.830005645752,2001-07-13
Date (MM/DD/YYYY): 07/16/2001,35.7249984741211,36.0800018310547,35.0750007629395,35.5900001525879,55990800,21.7810535430908,2001-07-16
Date (MM/DD/YYYY): 07/17/2001,35.3300018310547,36.0050010681152,35.0699996948242,35.9099998474121,63241000,21.9768962860107,2001-07-17
Date (MM/DD/YYYY): 07/18/2001,35.2999992370605,35.75,34.935001373291,35.2849998474121,57590800,21.5943984985352,2001-07-18
Date (MM/DD/YYYY): 07/19/2001,35.6100006103516,36.5,35.6100006103516,36.2849998474121,76549400,22.2063961029053,2001-07-19
Date (MM/DD/YYYY): 07/20/2001,34.0149993896484,34.7000007629395,33.9700012207031,34.5900001525879,124203600,21.1690521240234,2001-07-20
Date (MM/DD/YYYY): 07/23/2001,34.6199989318848,34.6199989318848,33.1749992370605,33.5449981689453,79999400,20.52952003479,2001-07-23
Date (MM/DD/YYYY): 07/24/2001,33.5,33.9949989318848,32.8499984741211,33.1599998474121,67530200,20.2938976287842,2001-07-24
Date (MM/DD/YYYY): 07/25/2001,33.1300010681152,33.7599983215332,32.8050003051758,33.7400016784668,74065400,20.6488552093506,2001-07-25
Date (MM/DD/YYYY): 07/26/2001,33.560001373291,33.6599998474121,32.75,33.2949981689453,77974000,20.3765182495117,2001-07-26
Date (MM/DD/YYYY): 07/27/2001,33.0250015258789,33.125,32.5250015258789,32.7350006103516,65396000,20.0337944030762,2001-07-27
Date (MM/DD/YYYY): 07/30/2001,32.8250007629395,33.439998626709,32.7700004577637,32.9000015258789,42196400,20.1347808837891,2001-07-30
Date (MM/DD/YYYY): 07/31/2001,33.0050010681152,33.6949996948242,32.9249992370605,33.0950012207031,59031600,20.2541179656982,2001-07-31
Date (MM/DD/YYYY): 08/01/2001,33.4000015258789,33.4049987792969,32.8800010681152,33.2350006103516,55679000,20.3398036956787,2001-08-01
Date (MM/DD/YYYY): 08/02/2001,33.6049995422363,33.7700004577637,33.1300010681152,33.7249984741211,54198400,20.6396713256836,2001-08-02
Date (MM/DD/YYYY): 08/03/2001,33.6500015258789,33.6800003051758,33.0,33.4449996948242,43260400,20.4683170318604,2001-08-03
Date (MM/DD/YYYY): 08/06/2001,33.2649993896484,33.560001373291,32.8400001525879,33.064998626709,27831600,20.2357578277588,2001-08-06
Date (MM/DD/YYYY): 08/07/2001,33.0200004577637,33.5250015258789,32.9949989318848,33.1749992370605,31347800,20.3030757904053,2001-08-07
Date (MM/DD/YYYY): 08/08/2001,33.2550010681152,33.6199989318848,32.2449989318848,32.4300003051758,54996400,19.8471355438232,2001-08-08
Date (MM/DD/YYYY): 08/09/2001,32.4900016784668,32.7750015258789,32.1500015258789,32.5050010681152,45536200,19.8930320739746,2001-08-09
Date (MM/DD/YYYY): 08/10/2001,32.3849983215332,32.9300003051758,31.4500007629395,32.7599983215332,51756400,20.0490989685059,2001-08-10
Date (MM/DD/YYYY): 08/13/2001,32.6199989318848,32.9949989318848,32.375,32.9150009155273,32675400,20.1439533233643,2001-08-13
Date (MM/DD/YYYY): 08/14/2001,32.875,33.0449981689453,32.2249984741211,32.3450012207031,36481200,19.7951202392578,2001-08-14
Date (MM/DD/YYYY): 08/15/2001,32.3549995422363,32.5250015258789,31.6000003814697,31.6000003814697,39503000,19.3391761779785,2001-08-15
Date (MM/DD/YYYY): 08/16/2001,31.4200000762939,32.3549995422363,31.3500003814697,32.310001373291,43905600,19.7736968994141,2001-08-16
Date (MM/DD/YYYY): 08/17/2001,31.8899993896484,32.064998626709,30.75,30.9400005340576,52234200,18.9352550506592,2001-08-17
Date (MM/DD/YYYY): 08/20/2001,30.8299999237061,31.375,30.5499992370605,31.3500003814697,48371200,19.1861820220947,2001-08-20
Date (MM/DD/YYYY): 08/21/2001,31.3500003814697,31.6000003814697,30.3549995422363,30.3899993896484,47111800,18.5986557006836,2001-08-21
Date (MM/DD/YYYY): 08/22/2001,30.5650005340576,30.5750007629395,29.5400009155273,30.3299999237061,78107200,18.5619449615479,2001-08-22
Date (MM/DD/YYYY): 08/23/2001,30.3349990844727,30.7649993896484,29.5,29.5599994659424,51813200,18.0907001495361,2001-08-23
Date (MM/DD/YYYY): 08/24/2001,29.7999992370605,31.1399993896484,29.6149997711182,31.0249996185303,63399000,18.9872741699219,2001-08-24
Date (MM/DD/YYYY): 08/27/2001,30.9500007629395,31.6800003051758,30.7849998474121,31.1550006866455,44562800,19.066837310791,2001-08-27
Date (MM/DD/YYYY): 08/28/2001,31.1700000762939,31.4750003814697,30.2900009155273,30.3700008392334,47422800,18.5864162445068,2001-08-28
Date (MM/DD/YYYY): 08/29/2001,30.5249996185303,30.6499996185303,29.7700004577637,30.125,48170000,18.4364814758301,2001-08-29
Date (MM/DD/YYYY): 08/30/2001,29.5200004577637,29.8299999237061,28.2600002288818,28.4699993133545,97632000,17.4236240386963,2001-08-30
Date (MM/DD/YYYY): 08/31/2001,28.4249992370605,29.0300006866455,28.1499996185303,28.5249996185303,57900800,17.4572792053223,2001-08-31
Date (MM/DD/YYYY): 09/04/2001,28.5949993133545,29.5400009155273,28.0349998474121,28.0499992370605,67189200,17.1665859222412,2001-09-04
Date (MM/DD/YYYY): 09/05/2001,28.0900001525879,29.1949996948242,27.6949996948242,28.8700008392334,89470600,17.6684188842773,2001-09-05
Date (MM/DD/YYYY): 09/06/2001,28.2800006866455,29.1949996948242,27.9500007629395,28.0100002288818,112356800,17.1420936584473,2001-09-06
Date (MM/DD/YYYY): 09/07/2001,28.0550003051758,28.6800003051758,27.6550006866455,27.7000007629395,89863800,16.9523868560791,2001-09-07
Date (MM/DD/YYYY): 09/10/2001,27.4599990844727,28.9750003814697,27.3500003814697,28.7900009155273,84471800,17.6194534301758,2001-09-10
Date (MM/DD/YYYY): 09/17/2001,27.0100002288818,27.5499992370605,26.3999996185303,26.4549999237061,127502000,16.1904373168945,2001-09-17
Date (MM/DD/YYYY): 09/18/2001,26.7049999237061,27.5,26.5849990844727,27.1599998474121,83182600,16.6219024658203,2001-09-18
Date (MM/DD/YYYY): 09/19/2001,27.2299995422363,27.3500003814697,25.2999992370605,26.9349994659424,126950200,16.4841995239258,2001-09-19
Date (MM/DD/YYYY): 09/20/2001,26.1749992370605,26.3050003051758,25.3349990844727,25.3799991607666,117983200,15.532546043396,2001-09-20
Date (MM/DD/YYYY): 09/21/2001,23.9599990844727,25.2999992370605,23.75,24.8549995422363,184976600,15.2112398147583,2001-09-21
Date (MM/DD/YYYY): 09/24/2001,25.3250007629395,26.2250003814697,24.9349994659424,26.0049991607666,85580200,15.9150400161743,2001-09-24
Date (MM/DD/YYYY): 09/25/2001,26.1350002288818,26.5,25.0799999237061,25.6499996185303,84940600,15.6977806091309,2001-09-25
Date (MM/DD/YYYY): 09/26/2001,25.7549991607666,25.8999996185303,24.7749996185303,25.1350002288818,58524400,15.3826017379761,2001-09-26
Date (MM/DD/YYYY): 09/27/2001,25.0499992370605,25.3400001525879,24.0,24.9799995422363,81191200,15.2877378463745,2001-09-27
Date (MM/DD/YYYY): 09/28/2001,24.8099994659424,25.7950000762939,24.4899997711182,25.5849990844727,116641200,15.6580076217651,2001-09-28
Date (MM/DD/YYYY): 10/01/2001,25.4699993133545,26.25,25.2049999237061,25.8950004577637,69999600,15.8477220535278,2001-10-01
